ReviewText,ReviewDate,ReviewAuthor,ReviewStarRating,Review Link
"Exterior Really great and looks good compared to SUV's in the same league.
Interior (Features, Space & Comfort) Quality of interior is good . However it is higly disappointing that Jeep has not provided reverse camera which is an essential requirement even in its longitude (O) variant.
Engine Performance, Fuel Economy and Gearbox I bought my Jeep compass(Diesel, 4X2) two months back and within few days of purchase, I have observed a high level of rattling sound from the engine. Sound was so irritating and often happens while accelerating at 2nd and 3rd gears and sound vanishes when accelerate further and  gets past 2000. Finally, I have observed that engine making rattling only when it is  starts from cold start condition and it persists nearly one hour. To my great greatest surprise, it was found that rattling noise vanishes when the engine stop and start again. I have demonstrated the problem to the dealer and they are now taking up the matter with manufacturer. I am looking forward for the action from Jeep.
Ride Quality & Handling Good.
Final Words Being an iconic brand, Jeep shoud have done more R&D on engine to avoid the issues with the engine sound.
Areas of improvement Additional features like reverse camera and larger infotainment screen.
Exterior, styleEngine rattling noise in cold start condition, Less features",04-Jan-18,JILS,3,https://www.carwale.com/jeep-cars/compass/userreviews/49922/
"I am using this car. Performance of the car is great. It’s around 7000 Kms driven. In 5000 Kms itself, i getting a disruptive noise in doors. And few more looser parts inside. It’s total disappointment. Now Continuously the noise is there while the driving. Even service providers couldn’t solve. At last they accepted that it’s vehicle complaint. And they created few more problems in door. Now the door is not close properly. I bought this vehicle with more interest and eager. But now I feel bad about it.",04-Jan-18,Arun,1,https://www.carwale.com/jeep-cars/compass/userreviews/49924/
"I purchased this rugged machine on November 6th 2017,I was waiting this car since last year before I had xuv 500 which is quiet difficult in handling and over noisy at higher speed but JEEP COMPASS is excellent car I had done no mistake ??,always I wanted to drive powerful car so wanted to buy Audi q3 but it's very much expensive so final compass filled my dream this car is excellent power,performance,looks and built quality totally Iam very much happy..I'll suggest all if anyone wants to buy mid SUV blindly you can go for JEEP COMPASS??",12-Nov-17,Ranganath,5,https://www.carwale.com/jeep-cars/compass/userreviews/49420/
"I bought a Jeep Compass on 28/1/2018 and yesterday on 04/02/2018 my car got broke down on the highway some where around 200 km away from my home. i don't know how a new car started vibrating and it was making noise, it was so humiliating and embarrassing for me  because i was with my family and relatives on a holiday trip and then this happened to me,  my cousins were making jokes and laughing on the car (On ME), the company dealer is saying that they have identified the problem and resolved it but i am so pissed off with the car that i don't want it back, so either you buy back the car and give me my money back or either give me a new piece because if the product is doing this within 7 days of purchase than I am sorry but I don't have any future expectations with this.    so just looking into this matter and resolve my issue because i don't expected this sort of CHEAP performance from a company like JEEP   samarth jain meerut
   lookspoor quality, issues in the engine in just one week",06-Feb-18,samarth,2,https://www.carwale.com/jeep-cars/compass/userreviews/50196/
"We brought a jeep compass about 20 days back.  On receiving the vehicle, there was a constant clatter from the front pair of doors or panels.  On reporting this, they took the vehicle to the workshop promptly, reporting post return, the issue has been resolved.  In turn, while one door, the noise had dampened, though not eradicated, on the other door, the sound had increased.  Now I have to myself try multiple maneuvres to try and reduce the noise.  The staff were helpful in the showroom but frankly, they are sales people and they could hardly make out the real issue.  Now I am still awaiting a call from their Pune office to correct the issue and mind you, this is only 28 days post buying the vehicle.
All in all, at this price, it is a huge huge disappointment.  FCA/Mopar - you really need to take care of your standards.
Worst experience!!!
The drive experienceQuality checks are an issue",17-Jul-18,Anindya,2,https://www.carwale.com/jeep-cars/compass/userreviews/56609/
The first long drive was disappointing. The Electronic Parking Brake failed after the first 150 km of my first long drive. And 20 km later the gear shift fails accompanied with strong rubber burning smell. 15 minutes later the car runs fine. The issues repeat during the return drive. Six days in the service centre - they are struggling to fix the issue.,09-Dec-17,Srinivasa,1,https://www.carwale.com/jeep-cars/compass/userreviews/49698/
It is some costly but fair and smoth body easy space good design good mileage this is extremely charming and useful for rural areas also this is first car which give us completely different satisfaction due to a little quality explanation space I will end my thoughts compass is our time whenever we tiered hapless saddy we will go a long drive.,15-Aug-17,Gopal,4,https://www.carwale.com/jeep-cars/compass/userreviews/48421/
"Exterior Head turner, stunning looks, Strongly built, very heavy as well. Front Grill with Jeep Brand stands out. started loving bad roads now (bangalore). Great presense on the road.
Interior (Features, Space & Comfort) Good features. Comfortable at all positions, strong AC and good music system. Enough space for boh rows. storage is very good
Loved carplay, button hand break, and multiple usb ports, dual AC temperatures, even the horn and lights.
Engine Performance, Fuel Economy and Gearbox Smooth gear box, very good engine and decent fuel economy.
Ride Quality & Handling Amazing riding experience, you wont feel any bad road now, real SUV feel. very steady at high speeds. cruises on highway. Overtakes 0-100 in few seconds
Final Words Best buy if you want a premium SUV. its truely premium feel inside and outside. enough of mahindra copying jeep all their life.
Great car for every road and SAFEST for your family than the japanese cars
Areas of improvement Add sun roof, Automatic (in diesel), auto closing of windows/side mirrors.
Super Power/ Torque, Strongly built/safe, Amazing looksnothing",15-Nov-17,Ravi,4,https://www.carwale.com/jeep-cars/compass/userreviews/49452/
"I am facing the death wobble issue in my NEW Jeep compass, I was near to hump and applied break and the car started shaking violently. This is a terrible issue and can cause accidents. 
I have talked to the dealer and they are not aware of this issue. They told they will look into this issue and rectify it. But I feel the technician who knows the problem can only fix it. Jeep should recall all cars and fix it. 
When you google you will find their are more jeep owners faced this problem and it persists from last 10+ years, how jeep is selling thier cars in India without fixing the problem. Time to think that you will see so many motivated videos regarding Jeep compass great personalities whom you can trust.
Style built qualityThey should have rectified this issue",19-Apr-18,Sant,4,https://www.carwale.com/jeep-cars/compass/userreviews/55853/
"Before I start the detailed review, let me express a concern over the genuinity of the reviews posted by people who don't own the vehicle. For those who go by cumulative rating, 3.5 stars seems way too less. But the fact is that some of the disgruntled users who had issues with dealerships had a major hand in the same.
When Jeep Compass released in India, it was crearly 1 segment above my reach from my 2011 Toyota Etios G Petrol. I had hardly driven 40K in 7 years and was absolutely in love with driving comfort of my vehicle. I had to go for a segment upgrade and was searching for a 7 seater and then Jeep happened.
The thought of owning a premium truly international SUV at that price tag, made me jump one segment higher and even moved me away from 7 seater segment. I got the vehicle booked under my employer's lease plan - but changed the booking in my name at the last moment due to some reason. Result, I had no waiting that seems to be the biggest concern here.
I got the vehicle delivered on Jan 7th 2018 - Minimal Grey (I had the roof painted black for 20 K from showroom, which I feel is worth every paisa).
Exterior The Black roof gave the machine a range roversque look and I was the first in my firm to own one. To put it briefly, it made me famous - very famous. Everyone knew the guy who had the Jeep. The build quality was evident when I had an accident where the left front wheel arch and left side view mirror went under a National Permit Lorry while attempting a risky overtaking maneuver. Had it been any other vehicle, the left side view mirror would have shattered. Here, it simply folded and resumed all relectronic functionality once retracted. The wheel arch suffered a minor dent, which was fixed off-show room for a nominal expense.
Interior (Features, Space & Comfort)
Features:
All safety features that Jeep offers are premium and have experienced the traction control, ECS,HSA and ABS in real time. Fortunately there was no need for Air-bag deployment. Worth the money! The Uconnect entertainment system easily paired Apple phones via Apple Car Play butyou can have multiple devices paired, including Android. There are two USB charging points one in the front and one in the rear. Air Conditioning is efficient with both front and rear vents. Once paired, you can use SIRI or accept calls from steering controls. You can change the songs or skip FMs from steering controls. The volume control is also provided below steering. Handbrake is electronic, which requires minimal effort.Sound system with 6 speaker and all weather subwoofer in middle of dashboard is pure bliss. Side-view mirror vissibility can be electonically adjusted. Wipers are efficient.
Space & Comfort:
Having not used an SUV before and comparing Toyota's etios, which is several segments below Jeep, I can confidently say that a sedan is a sedan and no SUV can match the comfort it offers. But again, one should not compare apples to oranges.  The biggest disappontment was that Jeep could not make it a comfortable 5 seater at the least. Rear middle passenger is really cramped (This with every passenger falling below 60 KG) and not suitable for long drives. The rear vissibility is also poor from rear view mirror when 3rd passenger occupies the seat. Boot Space is OKyish - If the boot fills up, rear view mirror vissibility is again impacted.
Engine Performance, Fuel Economy and Gearbox
Engine Performance:
This is where Jeep blew me away, FCA's 2.0 diesel engine is too good to be true. I had driven my etios for 40 K kms in 7 years. I have almost completed 10 K in my compass in under 3 months. It is a driver's dream. Driving comfort is unparallaled. 
Fuel Economy:
I followed the instructions from showroom of not exceeding 130 KM/H speed before 2000 KMs and got a mileage of close to 20 km/l in my first long trip to Munnar from Bangalore via Salem. There was minimal gear shifting required and I drove at constant 100 km/h speed. But it significantly drops with constant gear shifts and raising the vehicle suddenly.
Ride Quality & Handling Ride Quality is good, when it is used as a four seater. As per my family, it does not match the comfort of our etios. Handling is amazing.
Final Words This one is a head turner. Like old Onida Ad, world's envy, owner's pride. If only FCA could do something to increase the comfort of rear passengers, it would be really hard to beat Jeep in the segment.
Areas of improvement Ride comfort and rear seat. Boot Space. Rear view mirror vissibility.
Great Style and decent fuel economyRear seats are cramped - Strictly a four seater if using for long trips",19-Apr-18,Akshay,4,https://www.carwale.com/jeep-cars/compass/userreviews/55855/
"I am an Air Force Officer and was impressed by the Jeep 4X4 month offer and went to a dealer in Bangalore for enquiring about the same. I had carried my cheque book to book the vehicle in anticipation of an honest interaction with the sales person.
I first asked him about the CSD price list. He said that he doesn't have it. From the tone and tenour of his reply It appeared that he was giving me the concession and not the government. Then I enquired about the 4X4 month. Initially he was skirting the issue, and on my insistance and pointing out to a promo lying on the table, he confirmed there was such a scheme. I told him that I am waiting for some money as my mutual fund has matured and hence would book it ASAP. To this he said that I must book it immediately. He said that if the vehicle is delivered in May, then I will not get the offer.
I replied to him that the information I have is that if I book it before 30 Apr, I will be able to avail it. He again repeated that if the deliver is in May then he cannot give me the offer.
I was feeling that I was not sitting with a salesman of a reputed brand like Jeep. It was like sales at gunpoint. ""I cant say prices will increase etc..."" It was like sitting on the edge of a cliff waiting to be pushed off.
The product is very good, but this is not the end. But arrogant people like this waiting to  I have to go to these kind of people for service for the rest of the vehicles life. It is very difficult to do that after today's experince. When they can renege on their word today, they will do it every day
Hence I have glad that I did not sink my money into this unwelcome pit.
The BrandArrogant Staff",20-Apr-18,raviachu@gmail.com,2,https://www.carwale.com/jeep-cars/compass/userreviews/55866/
"My favorite and dream car it's smooth driving and high speed engine colors very very love it..... My The 2018 Compass is available in four trim levels: Sport, Latitude, Limited and Trailhawk. All come with a 2.4-liter four-cylinder engine (180 horsepower, 175 pound-feet of torque). A six-speed manual transmission is standard on the Sport, and a six-speed (FWD) or a nine-speed (AWD) automatic transmission is optional. All other Compass trims have the automatic as standard equipment. Front-wheel drive is standard and all-wheel drive is option",02-Nov-18,Aathi,5,https://www.carwale.com/jeep-cars/compass/userreviews/59986/
"A CAR NOT TO BUY This car's turbo sets in around 2500 rpm. Till it reaches this rpm the car hardly moves, then suddenly it flies off the handle. This is impossible to control under most circumstances. In my opinion it is an accident waiting to happen. When i bring this up with the service station they just shrug it off as normal in all Jeep cars. It has pathetic fuel efficiency. Be that as it may the engine capacity is so small that the car needs refueling constantly. I cannot go from Bangalore to Mysore and back without refueling. I discovered this pretty early after buying the car. I decided to sell if even before i reached 1000 kms and one month after i purchased the car. When i inquired the purchase price, i was not even getting a quote for 17 lakhs. I paid 24.66 lakhs for the car. Though most cars lose their value once you drive out of the showroom, the Jeep's resale demand is non existent. In my opinion these cars should be banned from sale in India",06-Jun-19,Pradeep,1,https://www.carwale.com/jeep-cars/compass/userreviews/93788/
No customer service.buying this car in December 2017. front headlight not working properly then I go to jeep service center..service manager told me without check my car sir car is absolutely fine. Pathetic experience,05-Feb-19,Sunny,2,https://www.carwale.com/jeep-cars/compass/userreviews/76384/
"It is good in or better in interior and facilities and bad in pick up,avg and service ,worst in avg claiming 15km and giving 7 km Response zero from company, I bought from Surat and in bought as useful car as automatic but facing difficulty in city also ,all other way good and no doubt about safety and interior ,workmanship good ,but expecting whatever company claiming should we get at least 90% Hope company will contact and resolve issue",21-Sep-18,Atul,2,https://www.carwale.com/jeep-cars/compass/userreviews/57440/
"Exterior Its good, but could have done better in paint department. Its good they cut in acessaries but they could have provided as, customer can buy it and fit it after purchase. This will reduce burden of roadtax. Their acessariies are not available easily and if availabe it too costly.
Interior (Features, Space & Comfort) Feature wise it missing cosmetic detailing. Space is one of the best in class. You can compare with Tuscon. Road handling is also good.
Engine Performance, Fuel Economy and Gearbox Diesel Engine is noisy its similar to what fortuner makes the sound. Fuel economy is good compare to its engine power its give good mileage. Gear box, dont know how long this will be smooth. If you really observe the vehicle their are lots of future plans for this vehicle. everywhere they left some or the other dummy sealed points. Might be in another 6 month, You may get switch to close the boot using  boot door keys also on the remote keys. Also one side of the sterring keys are blanks may be for cruse and other features.
Ride Quality & Handling Superb.
Final Words You cannot compare with Koriean brand its musch better than that. If you planning for Creata extend your budget and go for Jeep.
Areas of improvement As I told, its seems to me there are lots of future plans to enhance this vehicle. Remote Keys has 4 keys with two still to be added as a features.
the build quality is superb. Space is much more than Creta. Comfort is goodDashboard doesn't look like a cockpit if you compare with German car or even korean manufacturer",17-Feb-18,Sant,4,https://www.carwale.com/jeep-cars/compass/userreviews/55395/
"I would like to talk about the performance. There is an inherent Clutch/gear issue. My clutch burnt at 13000 kms. The service center states that, the vehicle is not suitable for city conditions and the clutch has relatively smaller grooves, which makes it wear out faster. They claim, they have reported to the Jeep, but not sure if they will take any action. I got the clutch replaced, and am now getting clucking sound, whenever I change the gears, or slow down/speedup. The service center states its normal, but i can clearly see that, its not RIGHT. I have now no idea what to do now!!!",15-Nov-18,Senthil,2,https://www.carwale.com/jeep-cars/compass/userreviews/62055/
"I am jeep owner from almost 2 years and after driving it more than 40k km I am writing this review. I don't advise people to buy it. Following are the pros and cons Pros..... 1) Its built quality and exterior is good. 2) You get good grip and control on high speed on highways. Cons...... 1) Jeep compass probably the worst SUV in its segment which has extremely poor and if I have to be blunt then pathetic turning radius and you literally have to take reverse on each U-turn in the city and if you are driving it cities like Mumbai, Bangalore then you are done. 2) even after taking care of the vehicle and getting it serviced on time the car started making noise. It's arm rest makes noise even the cover around steering wheel also not fitted well which also makes noise. 3) someone broke my wind shield which I got it replaced with new one but the size of new wind shield is little small and has not been fixed well it is making sound from the moment I got it fixed. 4) Most important point its engine stopped 3 times once on Express Highway and did not start then you have to wait for 20 minutes to get it started again which is terrible for a SUV where you have paid 20L. Even my 12 years old Honda City Engine never had this issue. 5) fabric seat covers after paying 20L is something you don't expect. In my opinion you should go for other SUVs instead of putting 20L in this or wait for another year to get better options as it has all basic features which you can get in any 10-12L car except electronic hand break. I bought this car thinking that its American brand and its going to be good product and after sales service but they have failed in both. They are selling inferior quality or they couldn't import quality which they sell in US or they are purposely selling poor quality products thinking that it's India and they can twist rules and regulations the way they want.",22-Jul-19,Ismail,2,https://www.carwale.com/jeep-cars/compass/userreviews/99441/
"I purchased this car in recently and drove 800km in all conditions (in city/ highway etc---). I am getting an average mileage of 5.4 km/litre instead of 12-14 which company is offering. Please check the mileage of this car before buying this variant. It is a petrol variant with an engine capacity is 1.4, not worth to drive this car if you get an average of 5.4/km.",22-Sep-18,Johnson,1,https://www.carwale.com/jeep-cars/compass/userreviews/57458/
"Exterior I don't really like huge SUV's (like the Fortuner or Endeavour) and in my opinion the Compass is just perfect. Its not too small and not too big. The design compliments the size very well giving it a superb road presence. I love the side profile and that chrome strip that differentiates the rood and the rest of the body. I love the rear which is complimented with a nicely done LED tail lights. (even non-led's looks good).
Interior (Features, Space & Comfort) Top notch interiors made from great quality materials. The leather seats, soft touch dash, soft touch top portion on the front doors and that superbly finished leather wrapped steering gave me a sense of luxury right away. The doors close with a nice sound and bloody hell its hefty. I got into the driver seat & pulled the centre arm rest froward and adjusted it to my driving position and boy it felt like a tank once I was done. There is a sense of security which I have never felt in any other car I've driven so far. Space is good in the front but spaces to put phones and other items lack a bit.
With the front seats in my driving position, I got into the rear and it was spacious enough. The seats are great but the middle portion lack underthigh support. The rear arm rest is super wide and it felt like the car is best for 4 adults. Overall 4 adults and a kid is ideal or 3 medium sized adults.
Engine Performance, Fuel Economy and Gearbox I'm a true petrol head and the diesels I've driven so far (S-cross 1.3 and Polo) had failed to impress me with the turbo lag and I expected the same since the compass has a bigger engine and bigger turbo, but boy the engine and the power delivery blew me away. The engine is smooth and there is no jerk whatsoever when the turbo kicks in. With 5 well weighed adults in the car, it pulled from 1400rpm in 3rd gear with ease. It was so linear and clean that it almost felt like I was driving a powerfull petrol mill. The gear shifts are notchy which is well complimented by a nicely weighed clutch. The steering has a lot of feedback and weight and it instantly gave me a smile.
Ride Quality & Handling Handlig was great, I didn't feel like driving a 1.5 ton machine but there is a sense of heft and I think its mainly because of the well weighed chunky steering and the tank feel the Compass has.
I cannot comment much on ride quality since I drove on a good surface but on that it as good and the car changed directions with confidence and ease.
Final Words I'm in love with this car and there is no other way to put. If I was in the market to get a car around 15lakhs, I would happily put 5lakhs more and will get the Longitude (O) model since it has the most bang for the buck. We can spend 10k for Jeep's original leather wrapped steering (5k) and reverse camera (5k) to add to the Longi (O) and make it a limited model without LED tail lights and leather seats.
Areas of improvement
1. Should have had 6 airbags on limited 4x2 at least.
2. Should introduce the 8.4"" uConnect system since the 7"" one is laggy.
3. Cruise control and auto dimming IRVM would be a great addition.
PS : I cannot care less about having a sunroof and auto headlamps and wipers.
Styling, Built Quality, Chunky Steering, Superb Engine and gearbox, Front Seats7"" UConnect system lags, Lack of 6 airbags for 4x2 variants (not even limited 4x2), Cruise Control",14-Sep-17,Rahul,4,https://www.carwale.com/jeep-cars/compass/userreviews/48764/
Very bad customer service. Great car brand but being run in india in worst possible way. There's no one accountable. Paid advance for the car July 2017 and still haven't got delivery and nobody is interested in resolving it. After 3 months of following up the answer is a sorry we can't deliver the car before 2 months which will make it one full year of booking for some who was amongst the first 100 bookings.,22-Feb-18,Siddharth,3,https://www.carwale.com/jeep-cars/compass/userreviews/55423/
I hvnt drive this car yet but i love to drive this car soon its just like a dream for me. I found the features of this car very cool nd with a awesome power nd a dashing look makes it a perfect drive in this budget. The best part of jeep i mostly like They are giving u all security nd safety fetures in their base model like 6 airbags in their base model thats really cool doen't it. So there lot of gud things u will find in this car. So guys hurry up dont take much time.,31-Jul-17,Gaurav,5,https://www.carwale.com/jeep-cars/compass/userreviews/48280/
