ReviewText,ReviewDate,ReviewAuthor,ReviewStarRating,Review Link
"While buying Landmark sales team did a poor job of committing the date of delivery and then changing at the time when we almost reached the showroom Secondly the insurance quoted amount was more than ?90,000 and when compared to other insurance company, it came down to ? 58000 Battery just after 14 months has drained out and they simply responded car is under 3 years warranty, not battery, not sure what more will not be under warranty, only time will tell Service is average as usual committed to delivery at 4 and finally waited at the service center for 2 more hours Costly service , ? 9600 for changing all what is required at the first service, mind it, this is without Kanpur charges, adding that after a period may shoot up I had Toyota Corolla and never paid more than ?6000 for each service The car is underpowered and hence drags at time I don’t think one can afford this car for more than 3 years as it may turn out to be a big cost of maintenance",08-Jun-19,Sanjay,1,https://www.carwale.com/jeep-cars/compass/userreviews/93959/
"Awesome car with stunning interior. I am lovin it. I wish to buy this mankind. But will wait for that day to buy this one for me. Really good to see Jeep have make this blast n such a good design. This is the compititor of Creta, Brezaa, XUV etc. Price value of this car is good as compare to other ones. People definately love this.",13-Aug-17,Ashish,4,https://www.carwale.com/jeep-cars/compass/userreviews/48396/
the service and maintenance of this vehicle is very poor .the technical staff is not competent to diagnose or to rectify the issues in side the vehicle which leads a very uncomfortable experience for a customer.They are only concern with selling of vehicle.so Jeep Compass needs to work on this segment as they have very less service centre and incompetent staff which is giving a very bad impression of a company.as vehicle performance is nice but as service centres are very less .,17-May-19,sanjay,2,https://www.carwale.com/jeep-cars/compass/userreviews/91405/
"Look wise very good ,average is also good and it is also 4*4 length wise also good. This car is also in both features auto and manual and ground clearance is also good. All windows are powe base",22-Feb-19,Aadarsh,5,https://www.carwale.com/jeep-cars/compass/userreviews/79630/
"Buying experience: Excellent dealership, purchased it 10 months back.
Riding experience: It's a wow experience, specially on highway excellent stability even at 160kmpl. No body roll. AC and audio performance top notch After 2000rpm it's like ` catch if you can ` . Also Stable if Breaking at high speed .
Details about looks, performance etc: Head Turner specially Red Color, simple and eligent Interior looks premium with good quality plastics.Bold looks
Servicing and maintenance: Not yet experienced. Service center nearby from my residence
Pros and Cons: Real SUV, Powerful engine , 160 bhp power for petrol, giving 10 kmpl milage for city,14 kmpl for highway. Cons more features required at entry level",04-Apr-19,Santosh,5,https://www.carwale.com/jeep-cars/compass/userreviews/86544/
I don't no how to describe its is very comfortable for long drive and the exterior was show awesome and the interior is perfect for the family the fuel is economically and the servicing and maintenance is also convince the price also economically compared to other branded SUV,24-Jan-19,Seitajit,4,https://www.carwale.com/jeep-cars/compass/userreviews/74002/
It has a modern look which is very attractive . But jeep maintenance service needs an improvement.It has a great booting space . It is very easy to handle but at high speed turning is little off .,17-Mar-19,Saswat,4,https://www.carwale.com/jeep-cars/compass/userreviews/84243/
"This SUV like others is good for indian roads. But it is more luxurious to drive it, a feeling of royalty. Look is good but no panoramic roof. Red color looks most sexy. Service stations are quite far. Price is ok as it is luxurious brand. Otherwise everyone could have purchased it and low down it's market.",10-Nov-18,Akash,4,https://www.carwale.com/jeep-cars/compass/userreviews/60947/
"- Mohair Auto NASHIK----------------Please dont buy vechiles form here, totally casual and non responsible service. - No commitment, no skilled staff - Even maruti 800 can give you good response for service. Pl dont buy",26-Mar-19,Mahesh,1,https://www.carwale.com/jeep-cars/compass/userreviews/85524/
"Riding experience: Super fine to be in the driver seat
Details about looks, performance etc: Superb from outside view looks so beautiful",02-May-19,Mahesha,5,https://www.carwale.com/jeep-cars/compass/userreviews/89621/
Best luxury & safe car it's fun to drive car go anywhere it's has all luxury features with powerful performance with trainn system it best performance in all like highway off-road city but for rear passenger want some more space with seat adjuster otherwise it's killer it's beat ranger over evoke I love it,21-Nov-18,Deepak,5,https://www.carwale.com/jeep-cars/compass/userreviews/63254/
"Jeep compass car a nice car I love it this car The Black roof gave the machine a range roversque look and I was the first in my firm to own one. To put it briefly, it made me famous - very famous. Ride Quality is good, when it is used as a four seater. As per my family, it does not match the comfort of our swift. Handling is amazing.",06-Jan-19,Sachin,5,https://www.carwale.com/jeep-cars/compass/userreviews/70680/
"I brought diesel variant car in jan 2019.My experience is just amazing. The features like Safety, comfort,fabric quality, seating arrangement and attractive look are realy good..I love it's full sunroof",02-May-19,Bhagyesh,5,https://www.carwale.com/jeep-cars/compass/userreviews/89626/
"You will easily miss this car among the hordes of compact suv nowadays seen on the roads, but Jeep Compass is definitely worth it's price. The looks are conventional yet appealing, LED headlights and rear lights gives it a distinct look. 17 inch tyres looks good on the body.The car looks beefy yet elegant at the same time. Enter the cabin and you cocoon yourself from the outside world. The door closes with a thunk which gives you an idea of the built quality. Start the car and you realize that engine is quiet enough. The audio quality of the infotainment system is good. The car drives really well at high speeds and is sturdy. While cornering the car it is steady , some body roll is there but ride quality is good. Small bumps do not filter their way into the cabin. Overall Compass offers a well balanced package.",28-Nov-18,Ritul,4,https://www.carwale.com/jeep-cars/compass/userreviews/64542/
"It's a great experience owning a Jeep brand which offers quality with all required features, instead of just being a fancy. It's really a great product. Great on highway, you will love to drive. With a speed limit of 100 on run of 500 kms I got an average of 20 litre/ per km.
Also you feel a sense of safety on road. Great Harmon music system The only vechile in segmnent will such security features.",17-Aug-18,Priyam,4,https://www.carwale.com/jeep-cars/compass/userreviews/56865/
"Riding experience: Really good powerful car with great roo for family
Details about looks, performance etc: IT HAS AN AMAZING LOOK WHICH CANNOT BE COMPARED TO ANY OTHER CAR IN THAT SEGMENT
Pros and Cons: It would be better if you open a showroom in mangalore",03-Mar-19,Rihan,5,https://www.carwale.com/jeep-cars/compass/userreviews/81443/
Hi I have been purchased Jeep Compass last year July still not complete 1year it has so many problems in engine side fuel pump failed no parts available at service agency in Hyderabad quality of service in Hyderabad jeep agency very poor my car it’s in agency since 1week no result please friends don’t go with Jeep Compass India service and performance very bad experience,12-Jul-19,SUDARSHANREDDY,1,https://www.carwale.com/jeep-cars/compass/userreviews/98340/
This jeep campus is looking very awesome . And Every person sea this car. And after Says wow superb. An I love this exterior look. Interior look. An feature is going well good.. jeep campus is my favourite...,17-May-19,Riyaaz,3,https://www.carwale.com/jeep-cars/compass/userreviews/91430/
"The amazing car ,jeep compass it is expensive but I feel comfortable in the car and the driving experience is amazing . The overall review is 5 star rating. In comfort Driving experience Engine power",10-Sep-19,Sai,5,https://www.carwale.com/jeep-cars/compass/userreviews/103466/
Very good vehicle with solid built feels like driving a tank fantastic gear shift and driving Dynamics. Totally high way suv. Interior is good and handy . Sound quality is amazing .perfect suv,01-Aug-19,Devendra,5,https://www.carwale.com/jeep-cars/compass/userreviews/100397/
"I bought my Jeep Compass year ago, ride quality seems good I won’t it’s Suberb cause rear seat comfort is not so good, I love the way the jeep looks the front Day time running LED is a killer! 2.0 Multijet engine is making the jeep more unique a say cause 180bhp and 350 NM torque and decent mileage trust me or not I got 18kms on highway! Touch screen navigation is responsive but well not as responsive as ford’s touch screen! Maintaince is on higher side I mean it’s bit costly obviously it’s jeep! Pros: great engine, looks are stunning even better fuel efficiency than rivals like fortuner and endover. Cons: rear ride comfort is not so good and maintaince and cruise control is big miss as well",06-Jan-19,Aashish,4,https://www.carwale.com/jeep-cars/compass/userreviews/70702/
"It's amazing look ,I want buy this car in after my job. That's my favorite car and brands. jeep brand is power drift and cool feature mode.its comfortable car and good space . mileage is very good, fuel economy card, high range car is a suitable price for people, work and maintenance cost not high..",30-Jan-19,Pradeep,5,https://www.carwale.com/jeep-cars/compass/userreviews/75310/
I love this car it's features are amazing.. Comfortable as well as interior and exterior looks is Awsome.want to buy in future definitely.. I tried the car once and I love it so much everything is just perfect..,07-Apr-19,Rajput,5,https://www.carwale.com/jeep-cars/compass/userreviews/86831/
"Excellent Sunroof in this car.smooth driving.no sound present in cabin.good looking alloy wheels .good duel tone color. Nice audio sound,nice instrument cluster. Good looking DRL. Nice traction control. Good quality leather used.nice seating adjustment in this car. Amazing mileage performance. Totally good .",18-Dec-18,Drpalash,5,https://www.carwale.com/jeep-cars/compass/userreviews/67888/
This car looks great and I drove it. it's ran like cheeta.my wish is to purchase this car in future.i love this Car very much and want be a owner of this fantastic car as soon as possible.a great experience in my life.,26-Jan-19,Rohit,4,https://www.carwale.com/jeep-cars/compass/userreviews/74548/
"Jeep look like a all features of car. This beauty not define in words. Defime in more more more words. I love jeep compass, 4*4 version so amazing not compare other car interior include all new features with all angles m buy this car in my future my dream jeep compass.",09-Sep-17,mohit,5,https://www.carwale.com/jeep-cars/compass/userreviews/48692/
1. It a value for money product for sure due to its class and the performance it generate. 2. Great comfort in terms of interior provided and it also provides very light handling in respect to suv’s. 3. Have Aesthetics looks and off road driving is at par. 4. The amount that goes in service is totally worth full.,07-Dec-18,Arun,5,https://www.carwale.com/jeep-cars/compass/userreviews/65847/
It's very good looking car So must important car suv in the life and the many features in the car . So i choose and bought the JEEP. I bought the top model in jeep in JEEP COMPASS LIMITED PLUS,22-Mar-19,Shubham,5,https://www.carwale.com/jeep-cars/compass/userreviews/85047/
"I bought jeep last year in may and it has been a blissful one year of ownership. To say the least, the JEEP has forced to make time frim my work and start living that collegue life of long drives with those never ending talks and discussions about life once again. It is a monster of an engine and the sleek gear box with that great aluminium finish round gear box is so silky smooth. Of course, there are some niggles but that cannot take away the sheer joy it gives me everytime I am behind the wheels. It is an epitome of go anywhere kind of freedom.",25-Apr-19,Gaurav,5,https://www.carwale.com/jeep-cars/compass/userreviews/88887/
"Very Awesome Looking Car, Good Space Comfort And Good Body I Love It. Jeep Company Power Full Engine Very Awesome.",24-Jan-19,Ketan,5,https://www.carwale.com/jeep-cars/compass/userreviews/74040/
Very bad experience with jeep compass my car clutch changed at 15000 km . They only give one year warranty of battery if buy this car you hv to buy battery after one year for sure . Bt the same company Exide gives its 4 yr warranty they frauding people . Loss of money buying this car,04-Jul-19,Suman,1,https://www.carwale.com/jeep-cars/compass/userreviews/97337/
"Details about looks, performance It's look very super and excellent performance. Very huge space and. good interior systems",26-Jun-19,chandru,4,https://www.carwale.com/jeep-cars/compass/userreviews/96314/
"I bought the jeep compass limited 4×4 in july under there upgrade plan for 4×4. So i purchased the car at a price of 23 lac instead of 25 lac on road. One thing i would i to say is that this is the beast when it comes to pure driving experience. No suv under 35 lac can beat it in terms of performance. I have one problem regarding some features but many of them has already been included in the limited plus trim at a cost of 2 lac more, so no issue of that also. My only suggestion to Jeep india is to price the longitude option model at 21 lac on road because of the newely arrived harrier. And please launch a diesel automatic in limited trim. If they do this than definitely there sales will reach around 1800 units a month. My suggestion to customer is if you are planning for a SUV and your budget is over 21-22 lac than definitely go for compass. But if your budget is tight around 18-19 lac than go for harrier XZ over creta and other. Remember one thing only the XZ model of harrier is good to purchase because the rest of models lacks safety features which are on my priority number 1.",25-Jan-19,Sushant,5,https://www.carwale.com/jeep-cars/compass/userreviews/74299/
I took loan from bank and bought this car. It's like a beast for both off and on road . It's a fashionable SUV and beautiful stearing wheel with comfortable handling. Value of money,11-Apr-19,Sanjay,5,https://www.carwale.com/jeep-cars/compass/userreviews/87355/
It is a good car like Scorpio. It has very power break and steering. It have 4×4 with good quality.airbags are available and cold ac with power windows and ips display you can drive it is a fantastic car,26-Feb-19,Sandeep,5,https://www.carwale.com/jeep-cars/compass/userreviews/80701/
This car is too awesome and driving experience is so much better then the other cars its my dream car and I also thanks to carwale.com for giving this kind of useful informations about our True car and its make easier to choose perfect one,31-Mar-19,Jayesh,5,https://www.carwale.com/jeep-cars/compass/userreviews/86077/
This car is very good looking and very comfortable car fiture is so easy and drive very simple I have to drive this car so comfortable and I love drive for this car jeep compass car loking so beautiful and nice dision this car engine is very power full and Milege is very good in according to other petrol car acoding,11-Nov-18,Surender,4,https://www.carwale.com/jeep-cars/compass/userreviews/61245/
"Buying experience: It was so easy and convenient .
Riding experience: Feels like you have got a powerful machine underneath.
Details about looks, performance etc: Looks so stunning everything in a proper portion and crafted with the perfection. Smooth as ninja sword.
Servicing and maintenance: Very nice feels very covenant.
Pros and Cons: 100 pros 0 cons . A all packed performance car with the best in class features.",12-Mar-19,Rishabh,5,https://www.carwale.com/jeep-cars/compass/userreviews/83262/
pros: new for indian market still had a great start for jeep brand and public requirements are fulfilled by jeep facelift or new varieties. No cons for the car all the needs at affordable prices and people get and perfect pack of features at very good price point. Loved the car design and it's something unique for indian market. ????,11-Nov-18,Aniket,5,https://www.carwale.com/jeep-cars/compass/userreviews/61247/
"It is a very good car, In a good price this is one of the only cars I liked out of all of them. Jeep has never disappointed me I have been having a jeep car since 5 years and I like this the most because of its features and speed. This car is the best for its price this is the prime reason I suggest this car to everyone who is wanting to buy a car.",11-Nov-18,Aarush,4,https://www.carwale.com/jeep-cars/compass/userreviews/61249/
"Awesome interior , comfortness is in the peak , better space , powerful engine , suspension is better enough .. You cannot take your eyes away when u see it and you caanot take your hands aways when you drive it..",19-Jan-19,Ashish,5,https://www.carwale.com/jeep-cars/compass/userreviews/73026/
I had buyed a longitude option model Brand feel Classy music system Best pickup Average is only 10 to 15 Fake average by jeep ie- 16-17 But average doesn't matter for this car A successful car for me As I am using Main feel of this car is on highway Being on 160-170 feels like we car go more And nice braking system Happy with this car.,21-Jun-18,Sanjay,4,https://www.carwale.com/jeep-cars/compass/userreviews/56386/
"Its a car which is very luxurious. Its name is jeep compass which is very luxurious and comfortable . its colour is very nice. It has all the facilities. I liked it very much. I thanks carwale very much because before I bought first I see this car on carwale. It can be comparable to bmw, audi, mercedes etc. I tell everyone to buy this car. It is a good car in this budget. Its features are best in world. Its sunroof if awesome. Thank u.",11-Dec-18,Rohan,5,https://www.carwale.com/jeep-cars/compass/userreviews/66629/
I live in Gujrat. I had an Honda City Petrol. I took this while twice to Manali. The fuel expenses was a lithke bit higher but the feel was good. Then I tot for a SUV which would be powerful and can meet my driving craze. I zeroed in on JEEP. I took it to Goa and just few days back I took it to Ooty and then Kerala with my family. The drive was fantastic. The performance of this vehicle is too good. U will nvr feel it is leaving the road. I recommend only Jeep. My total running is 7350 Kms. No complaint yet.,15-Jun-19,PRIJIT,5,https://www.carwale.com/jeep-cars/compass/userreviews/94789/
Amazing vehicle with loads of comfort and excitement. I still remember the new vehicle smell when took 1st drive and my hands was like stick to stearing . Its a cockpit with a great view and the sunroof made tht experience even more greater. Loved this....even a old person will feel like young when they will try this beast with beauty.,18-May-19,Alok,5,https://www.carwale.com/jeep-cars/compass/userreviews/91462/
"Awesome handling, good tyres, perfect driving for hill station .. nice exterior and interior , specially the logo of jeep compass . It's so handsome looking , but it should have sunroof ,its value for money if sunroof would been added . And it should have chrome set alloys , u should change alloy .",26-Jul-19,deep,5,https://www.carwale.com/jeep-cars/compass/userreviews/99910/
The car is so much compotable and sheet must beeter then other car and look are awosome and features are expensive for me and I love this car and I want tell for jeep u want to make a more suv like the compass suv ok thank for making this car and I want some more car like this.and we have seen and driven many car but not comfortable like jee compass,26-Dec-18,Abid,5,https://www.carwale.com/jeep-cars/compass/userreviews/69447/
It's good in prize & drive. Feel good to drive. easy handling. Good brand. Powerful body. Good mileage. Attractive design. Big space.. beautiful interior big seats. a reasonable price anyone can by & feels good,03-Feb-19,Rajender,5,https://www.carwale.com/jeep-cars/compass/userreviews/76103/
I got Delivery of the car in a week Very good ride I like looks and getting mileage of 14 km/l in city very good compact SUV for family of 4 Got no much experience regarding service but the adviser of the dealership visit it at homeIf anything to complain company providing less features backseat comfort could have been better,19-Mar-18,Ajay,4,https://www.carwale.com/jeep-cars/compass/userreviews/55623/
I have purchase it on february 2018. With in 1 year my car battery has been changed due to battery fault.I have send the battery to exide Company depo. They changed it and send me the new battery today. But again right know the battery is ok but the car is not starting.. This is not the fast time i faced a problem.. Before also break pad gone at 25000 km. and my front two tyre also damaged at 23000 km.. I have a toyota innova crysta also but till know the innova never give me such a trouble what jeep is giving me.. Such a bad car jeep compass..Unsatisfied for buying this car..I have done a big mistake for buying this car..,11-Jan-19,Nirvik,1,https://www.carwale.com/jeep-cars/compass/userreviews/71498/
A rich and royal car with a resonable price i like the as much i love dad and mom and the interior is simply extraordinary and the car colors are very mich catchy and i am waiting for buying this car,07-Apr-19,A,5,https://www.carwale.com/jeep-cars/compass/userreviews/86858/
"Buying experience of Jeep Compass is completely good package because of its safety features, brand value, commanding design, fun to drive and off-road chops. Riding experience is outstanding specially in diesel variant because it is more powerful than it's rivals. Ride Quality is outstanding and amazing on the highways is a great cruiser around the corners and stability of this car is perfect. The looks of compass remains one of the most attractive design in its segment with its seven-slat grille and squared off wheel arches proudly proclaiming it's iconic jeep heritage. Performance is excellent around the corners and body roll is excellent on the highways. Compass 4×4 limited plus variant goes over the off-off-road with ease because of its independent suspension. Servicing cost and maintenance cost is very reasonable and jeep have introduced Mopar, the global giants in all jeep vehicles. Mopar is one-stop shop for your jeep vehicle's, maintenance, service, performance upgradesupgrades and cosmetic increases, so your jeep vehicle stays in perfect condition for your adventures always. Pros and Cons: PROS: 1.) It gets panaromic sunroof in top of the variant. 2.) Acceleration is outstanding than its rivals. 3.) Fit and finish is excellent and interior quality is top notch and feel premium than its rivals. 4.) Class leading off road capabilities with its independent suspension. 5.) Smooth Manual Gearbox and easy to use. 6.) Owing to Off-Road charactercharacter, compass gets four driving in top of the variants in its selec- Terrain all wheel drive system such as Auto, Snow, Sand and Mud to adjust engine mapping and traction control to move easily over the selected terrain. 7.) Diesel motor is punchier, nicer to drive and good highway cruiser. CONS: 1.) Too Pricey 2.) Poor Rear Seat Comfort and feels claustrophobic and not good for three adults. 3.) Clutch of Diesel variant is much heavier and not good for city use. 4.) 7 speed DCT Automatic is not very smooth, quickest, lacks punch and feels jerkiness. 5.) Missing some features. 6.) Petrol engine is very noisy than its rivals. 7.) The brakes are good, but while slowing down from high speeds it seems to lack the necessary bite for sharp and effective braking.",26-Jul-19,Vineet,5,https://www.carwale.com/jeep-cars/compass/userreviews/99914/
the rare tyres are getting drain. i have changed the tyres in 15000 km and now again at 20000 km. i complement to service center and mailed to jeep India they are not responding....,07-Mar-19,Deepak,1,https://www.carwale.com/jeep-cars/compass/userreviews/82251/
Buying Jeep Compass was the best decision that I have taken in my entire life. I love driving it’s very easy and comfortable to drive those who love suv this is the one and the looks are on other level and when we comes to performance it’s the best its easy to drive on every situation weather its is off-road or god its very comfortable to drive servicing rate is little huge because it’s America vehicle. Maintenance a big job we can do that totally we won’t regret buying this car,20-Jun-19,Akhilas,4,https://www.carwale.com/jeep-cars/compass/userreviews/95565/
"Yes , this car is very nice , inside interior decorations are very beautiful and comfortable . Driving experience are also fine , but I want to add Auto gear system if i wl be owner of Jeep company . Otherwise very satisfied I am. Need less to say the price in mid renge also That's why every business man can get this bike easily. And I want to request Jeep company to reduce emi system on this bike and extra 3 lacks pay on EMI system",19-Nov-18,Anay,5,https://www.carwale.com/jeep-cars/compass/userreviews/62798/
I like your application because i see full 360 degree view of cars and then final my car it possible only your app thanks car wale Nice app and website ever thank you. And last thanks to all creater wgo make this.,14-May-19,Khush,5,https://www.carwale.com/jeep-cars/compass/userreviews/90959/
