ReviewText,ReviewDate,ReviewAuthor,ReviewStarRating,Review Link
"My name is Johnson Correya and I currently reside in Powai (Mumbai). I have purchased a petrol model Jeep Compass Sports Variant with Manual Transmission. Before buying the vehicle, I had checked reviews on different websites about this vehicle and discussed the features with the sales team, especially with the salesperson from the Landmark Mumbai showroom (Abhishek). All automobile related sites and the salesman had claimed that the mileage for this model is 14-17 km/liter. I don't have any other problems with this model except the mileage for which I am getting an average of 5 to 5.5 km/liter with a mixture of conditions like traffic, without traffic and high way etc. I approached the CRM Mr. Salim who asked me to bring the car for a check-up. I dropped the vehicle off on 14/11/18 after completing 1200 km. I had reset the meter just before I dropped the vehicle at the service center. Service adviser Prateek attended my vehicle and suggested me to come back after 3 days as they wanted to test the entire vehicle. I complied and collected the vehicle after 3 days had elapsed. While I was collecting the vehicle, he informed me that they had checked the vehicle in traffic conditions and they had gotten 10 km/liter with no other technical issues in the vehicle. They have written the average mileage as 10 km/liter in the service form. I checked the mileage meter just after leaving the service center then I realized that the mileage was 4.5km/liter and they have driven the vehicle 14.5 km. It was a barefaced lie which they told me that they got 10 km/liter in traffic conditions. I had informed the mileage issue to the CRM (Salim) again. He had suggested that he would send one person with me to check my driving pattern. He had sent Aditya Dhere on 23.11.18 at 6 pm at my office. He accompanied me for 2 km in traffic conditions. He understood that the issue is with the mileage and not with my driving patterns. He had taken a picture of the mileage meter and sent it to the CRM. We got 2.2 km/liter for around 2 km drive with 25 minutes of travel. I don't travel always in traffic, 5-5.5 is an average of a mix (all conditions). It is not worth driving this vehicle with the kind of average I get and why the company is offering an impossible mileage of 14-17 km/liter is ludicrous and preposterous. They haven't given any solution till date. My humble request to the customers, please do not buy Jeep compass as they are selling the car with fake commitments."," Jan 17, 2019 ",By Johnson,1.0,https://www.cardekho.com/user-review/jeep-compass/petrol-driking-mechine-avrage-56kml-27871.htm
"Limited plus
A heavy car with nice looks. The best part is a dual panoramic sunroof."," Jan 17, 2019 ",By Diko,5.0,https://www.cardekho.com/user-review/jeep-compass/limited-plus-27869.htm
"Comfortable car
It's a very nice car and I satisfied with their safety and facilities. Very easy for long traveling and very safe for us."," Jan 28, 2019 ",By Darshan,4.0,https://www.cardekho.com/user-review/jeep-compass/comfortable-car-29599.htm
"The buying experience was very bad. The only mistake I did, never checked the mileage of the car. I believed the sales person who told me the average mileage is 14-17km/L. The Jeep team is not ready to accept the mileage issues. I have sent several emails to the entire Jeep team and there were no reply and solution. I am getting an average mileage of 5-6KM/L after driving 2500km with different conditions. My humble request to all customers who are planning to buy Jeep compass, please check the mileage on different conditions (traffic /non-traffic etc.) to get the real mileage. Do not believe the salesperson who just wants to sell the car."," Jan 17, 2019 ",By Johnson,1.0,https://www.cardekho.com/user-review/jeep-compass/petrol-drinking-car-56kml-27867.htm
"Finally Big toy in my house
Awesome deal, I really want to buy Jeep Compass and I am already booked this."," Jan 15, 2019 ",By Dr. Malkeet,5.0,https://www.cardekho.com/user-review/jeep-compass/finally-big-toy-in-my-house-27708.htm
"WOW WHAT A BEAUTY
Jeep Compass has a superb road handling, good mileage manly looking what more can one ask for?"," Jan 15, 2019 ",By Salim,5.0,https://www.cardekho.com/user-review/jeep-compass/wow-what-a-beauty-27659.htm
"Don't buy jeep
Worst after sale services of the jeep. RSA of jeep crushed my jeep and now no one listening to buying is the worst decision."," Jan 11, 2019 ",By Daleep,1.0,https://www.cardekho.com/user-review/jeep-compass/dont-buy-jeep-27244.htm
"Jeep features
Jeep Compass is very nice, It looks Well good and it is a very safe car I like it......"," Jan 08, 2019 ",By Farren Darr,4.0,https://www.cardekho.com/user-review/jeep-compass/jeep-features-26957.htm
"Jeep is fabulous
It is a fantastic car, if you want to enjoy a real drive in hilly areas and in straight and rough roads, it gives you a pleasant drive and experience. New sunroof facility is awesome, I have to wait for it for a long time. Read More"," Jan 06, 2019 ",By Mamoon Anis,5.0,https://www.cardekho.com/user-review/jeep-compass/jeep-is-fabulous-26736.htm
"Awesome look, space and sunroof look batter then o
Awesome look, space, and sunroof look better than other cars like Porsche.....The car has great power.....and amazing looks......."," Jan 05, 2019 ",By Nitin,5.0,https://www.cardekho.com/user-review/jeep-compass/awesome-look-space-and-sunroof-look-batter-then-o-26647.htm
"Jeep compass
It is an awesome car in this price, Jeep brand is Awesome, you do not need more if you like Jeep."," Dec 31, 2018 ",By Taniya Ahuja Bajwa,5.0,https://www.cardekho.com/user-review/jeep-compass/jeep-compass-26185.htm
"Jeep compy
Jeep Compass is a Superb car and it should be available all facilities and also good mileage."," Jan 10, 2019 ",By Harish Muthyala,5.0,https://www.cardekho.com/user-review/jeep-compass/jeep-compy-27146.htm
IT IS A VERY MUSCULAR CAR WITH BOLD AND ATTRACTIVE LOOK BUILT QUALITY IS AWESOME POWER EXTREMELY NITRO GOOD SPEAKERS OVERALL IT IS VALUE OF MONEY EVERYTHING IS THEIR IN THIS CAR ACCEPT PADDLE SHIFT BUT OK WE MANAGE.," Jan 09, 2019 ",By Vishal Gupta,5.0,https://www.cardekho.com/user-review/jeep-compass/value-of-money-27059.htm
"Best in class !!
The all-new Jeep compass is absolutely a no doubt car with first in class features. The 4×4 option is so amazing that enables you to go for long drives as well as off-roading. But it comes short when it comes to comfort as the brakes may make you feel a little uncomfortable. Overall, it makes up with its better fuel economy. The Jeep Compass is exc...Read More"," Dec 23, 2018 ",By Pampana Rama Koti,4.0,https://www.cardekho.com/user-review/jeep-compass/best-in-class-25167.htm
"Best on Highways
Very Very Stable on speed 160-180. Luxury with comfort. This SUV is not just a simple 7-seater but a perfect vehicle for those who love power and class both..."," Dec 29, 2018 ",By Anshul,5.0,https://www.cardekho.com/user-review/jeep-compass/best-on-highways-25906.htm
"Good look and strong suv
Good looking smooth engine with a panoramic sunroof, Led DRL are looking superb."," Dec 21, 2018 ",By Alok,5.0,https://www.cardekho.com/user-review/jeep-compass/good-look-and-strong-suv-25009.htm
"What to say about Jeep. It is favolus
It is A fantastic car, if you want to enjoy a real drive in hilly areas and in straight and rough roads, it gives you a pleasant drive. New sunroof facility is awesome, I have to wait for it for a long time. Read More"," Dec 23, 2018 ",By Abhishek,5.0,https://www.cardekho.com/user-review/jeep-compass/what-to-say-about-jeep-it-is-favolus-25170.htm
Wow!! wot an SUV which is a perfect SUV There is no one Like compass super smooth super slint super grip That is Fully Superb If you plan the buy SUV so just think about Compass*," Dec 21, 2018 ",By Mubeen Khatri,5.0,https://www.cardekho.com/user-review/jeep-compass/if-you-plan-the-buy-suv-so-just-think-about-compass-24880.htm
"Rugged and powerful SUV
The Jeep Compass is a powerful and extremely powerful SUV capable of going off-road. It is also loaded with a tonne of features."," Dec 16, 2018 ",By Balamurugan S,5.0,https://www.cardekho.com/user-review/jeep-compass/rugged-and-powerful-suv-24146.htm
"I got this little monster a month back, great build quality and more overhead-turning looks good. Good quality ride, but getting bit noise in the engine may be solved after first service hope so. Overall a good car."," Dec 15, 2018 ",By Anil,4.0,https://www.cardekho.com/user-review/jeep-compass/little-monster-24064.htm
"Awesome SUV
Amazing driving experience in one word. Ride quality is excellent along with quality interiors & comfortable seats. Awesome & head turning look. Purchased cream white Jeep Compass Limited 4X4 from landmark showroom, Moti Nagar, Delhi in the beginning of this month. Supportive, enthusiastic sales team & staff with the unmatched buying experience. Read More"," Dec 15, 2018 ",By Amit Chaurasia,5.0,https://www.cardekho.com/user-review/jeep-compass/awesome-suv-23994.htm
Great in look and smooth in Ride. Best for off-road driving. The engine runs smooth. I am having a limited variant which is totally great. If you are searching a compact SUV and then the Jeep Compass is the off-road king. No car is better than this in its segment. It also fits in the budget.    ," Dec 13, 2018 ",By Aryan Singh,5.0,https://www.cardekho.com/user-review/jeep-compass/offroad-king-smooth-in-ride-23844.htm
This car is a part of my family for 16 months have overcome all the obstacles and performed very well on the off-road and doing till now. Compass has the perfect build quality and safety features.," Dec 07, 2018 ",By Umar Noor,5.0,https://www.cardekho.com/user-review/jeep-compass/stronger-and-fully-loaded-with-features-23194.htm
"We are a family of four and we all are really fond of cars including my little one 2 years old as well. The elder 10 year old son can rattle the power and torque figures of different cars. Most of the cars we have owned are driving oriented and we always take the build quality, driving dynamics and safety as top priorities every time we choose a new car. Just to name the cars in our fleet in the past, we owned Ford Fiesta, Honda Civic, Skoda Yeti and Laura. All these cars gave brilliant experience with well sorted performance. But choosing the Yeti successor was quite a difficult task as the list of priorities increased all these years. We shortlisted the priorities which included nice driving dynamics, strong build quality and safety, leather steering wheel, leather seats, silent/powerful diesel engine, spaciousness, distinct styling and of course, the hill hold control since I have phobia of rolling back. So, fortunately we were able to shortlist the cars and the list included Renault Duster, Audi Q3, BMW X1, Skoda Kodiaq, VW Tiguan and Jeep Compass. The Audi and BMW were rejected due to fact that our regular drives to the outskirts where my grandparents live would prove a nightmare for these cars. Skoda Kodiaq and VW Tiguan were outrageously priced for what they offer while we listed out Renault Duster because it lacks adequate safety features. So, the last option remained in the list which was meeting all our expectations was Jeep Compass. Now coming to the initial experience, man, it's a head turner. Wherever I take my blazing red Jeep Compass, it really grabs eyeballs. It has pretty striking similarity with the Range Rover Evoque, especially the blackened roof. My wife is really smitten with this car, during the early drive of 40 kms, we drove equally for 30 kilometers. The car is exceptionally comfortable to drive with the engine barely audible from inside even if you cruise at the speed of 80kmph. The 2.0L engine produces 173PS and 350Nm of peak torque with the SUV giving above 16kmpl mileage in mix conditions which is pretty much acceptable given the stature of the car. With linear acceleration, the vehicle can reach the 80-90kmph mark in no time. The engine is quite smooth and does not have turbo lag unlike other cars we owned in the past. Coming to the part which I liked the most is the robust quality this car comes with. It is heavy especially the doors, hood and the tailgate. The car comes with all the safety aspects which we needed including dual airbags, ABS with EBD, electronic stability control, hill start assist, electronic parking brake and ISOFIX rear child seat mounts. The braking is adequate and it comes to halt in the straight line without any fuss. In terms of comfort inside, the car is an absolute bliss with enough legroom at the rear which most people complain about in the car. The car has all the contemporary gizmos including the 7-inch touchscreen with Android Auto support and a very effective air conditioner. However, the sound output from the AV system was mediocre although one can always add extra speakers to increase the decibels. Driven over 3000kms so far and it has been a wonderful experience with this car. Anyone who wants a little show-off with utter cabin comfort, safety and smooth engine performance, I think Jeep Compass can be a good choice under Rs. 25 lakhs."," Nov 19, 2018 ",By Shailendra,5.0,https://www.cardekho.com/user-review/jeep-compass/jeep-compass-my-experience-after-driving-3000kms-21737.htm
"I bought Diesel variant car in May 2018. Followings were in my mind while choosing Car.
1) Safety
2) Comfort
3) Quality
4) Attractive Look
5) Power If you are practical to have number of features over your paying price, then this Jeep Compass is not for you. Many other brands giving you so much in 65% price of Jeep Compass. They are committed for after sales service but they may have a practical issue with on -road service or stock issue as they are rising and not completely established. But Jeep is always known for Lavish driving and safety. If you are a passionate driver then this Car is for you. I drove almost 4000 KM in a month. I had a good experience. One more thing any variant of Jeep compass does not have any mechanical change except 4X4 ,6 Airbags and Tyre Size. All is about Exterior and Interior. You will get the same pleasure in any of variant. Jeep is Jeep. I love it. I was looking for Make In India Concept and came to know Jeep has been manufactured at Ranjangaon facility in Pune. 65% material was bought from local vendor. Also they are exporting International."," Jun 13, 2018 ",By Dshah,5.0,https://www.cardekho.com/user-review/jeep-compass/jeep-compass-the-car-for-lavish-driving-19754.htm
"I took a test drive of Jeep compass petrol automatic (top end) and was surprised to find that the basic features of this car is missing at a price tag of 25 L.
Pros
Good build quality
Comfortable
Cons
Basic features missing like LED headlamps, cruise control.
Just 2 airbags
Audio system is no better than Maruti's
Spare wheel is of smaller size thus it will cause stability issueBetter options are available in the market"," Jun 09, 2018 ",By Ashirwadgoswami,1.0,https://www.cardekho.com/user-review/jeep-compass/better-options-available-19724.htm
"Amazing Driving Experience.
I bough Jeep compass Limited on 6th Nov 2017. Actuallly I am a Hyundai lover & using Hyundai cars from last 10 years. But in July 2017 Jeep Compass was launched in India & after a month study on jeep, I planned to purchase compass by cancelling my booking of Hyundai Tucson. This is one of my great decision to purchase a jeep compass in Black colour...Read More"," May 18, 2018 ",By Amresh Sawant,5.0,https://www.cardekho.com/user-review/jeep-compass/amazing-driving-experience-19576.htm
"It's a great vehicle with an awesome build quality and high safety standards. Great to drive on the highway with excellent ride and handling.
Great Build Quality - Excellent exterior and Interior Quality.
Finish - Harman excellent music system - only in a segment with 50 security features as a standard."," Aug 17, 2018 ",By Priyam,5.0,https://www.cardekho.com/user-review/jeep-compass/the-real-jeep-jeep-compass-a-true-quality-product-20226.htm
"I bought Jeep Compass one month back n now close to 2000 km drive . Yesterday I had horrible experience when driving in pune city . I was driving in city with my family n suddenly fire smoke started from front bonnet. My family scared n all side vehicle people started pointing me abt smoke. Some how I managed to park on side of the road , after 20-30 min smoke stopped. I tried all helpline number n staff number but no body has responded. I can say worst decision of my life to choose Jeep Compass. I request to all readers don?t purchase Jeep Compass or any model of Jeep Compass."," Jun 06, 2018 ",By Sujit Kulkarni,1.0,https://www.cardekho.com/user-review/jeep-compass/horrible-life-threatening-vehicle-19707.htm
"Pathetic after sales service
The Jeep Compass is good at build quality performance which can be easily washed away when you compare the after-sales service experience."," Dec 06, 2018 ",By Sankalp Avenues,1.0,https://www.cardekho.com/user-review/jeep-compass/pathetic-after-sales-service-23134.htm
"I bought a Jeep Compass Longitude optional a year back in Sep 2017 and was enjoying my drives like any other user, the overall performance of the vehicle is as good as expected, but when I went for the service my overall experience turned down.  "," Dec 06, 2018 ",By Krishna,2.0,https://www.cardekho.com/user-review/jeep-compass/good-to-drive-23127.htm
"I took the Test drive of Jeep Compass top variant a month back, and it was a superb drive. The build quality of the car seems good and compass have all the features including a panoramic sunroof, an 8.4-inch touchscreen infotainment system, an 8-way powered driver's seat, 18-inch wheels and more. A worth option to consider if you want to buy a SUV under 20 lakh. "," Oct 04, 2018 ",By Shipra,5.0,https://www.cardekho.com/user-review/jeep-compass/awesome-test-drive-experience-20673.htm
"Pros - It has a powerful and punchy engine with an amazing build quality. Good Interiors.
Superior ride quality and handling. The design is simply spectacular. Cons - Small screen size for ICE. Sunroof is not available. Dummy buttons. Still, I love this car and am waiting for the delivery."," Sep 14, 2018 ",By Mathew,5.0,https://www.cardekho.com/user-review/jeep-compass/excellent-car-20518.htm
"I bought limited(O) diesel from Mohali dealership on 10th January 2018 and I must say my experience till now is great in all aspects.When I confirmed my purchase, I got delivery next day as one day took for banking formalities. That was amazing experience. The dealership here in Mohali is very professional and customer oriented, they even changed the car before delivery as I found one paint issue in the previous car and they provided a new car. They gave me plenty of time to check and verify the car again till I got satisfied. Till now I have driven around 3350 kms and my experience is awesome either in city or highways. As Chandigarh/Mohali doesn't have traffic like Delhi or Mumbai, I am getting mileage of around 16.5 km/l and on highways it gave me maximum of 20.5 km/l while driving at maximum speed of 100 km/hour. I love the interiors, although maintenance is high as seat covers and doors are light colored as per my model but it looks premium. The music system is great as well electronic break, it is a great feature. Also You can manage other stuff within infotainment system like controlling lights, doors, phone etc. People are saying that it doesn't have cruise control but for me it is not essential as in India, roads are not build for it. When you are on highway, any animal or people can come in between. I think sunroof could be a good option if they add in the future as well automatic in diesel. I don't mind manual transmission but automatic is helpful when there are long traffic jams. As far as car's build is concerned, It is heavy build with great quality. On highway, I had a major accident when a Harley Davidson rammed into right front grill/bumper and to my surprise, It got nothing except a small scratch which was removed by dealership later on. I must say the quality is really good. Car is a head turner for sure, I have seen how people react when you are on road, it gives a personality and car looks very rugged and manly. I have heard bad reviews about dealership and services but nothing like this happened to me. Even they gave me training to use infotainment system as well the best way to maintain the car. They are available on one phone call. I am happy with my choice. If anyone wants to ask anything, feel free to write me."," Feb 16, 2018 ",By Sunil,5.0,https://www.cardekho.com/user-review/jeep-compass/great-car-with-great-service-19056.htm
"Jeep Compass - Attractive Design and Amazing Performance
Jeep Compass as the name strikes the mind, we get the image of the hardcore off-road Jeep-like vehicle but that?s not the case with the Jeep Compass. Though it?s a plush as well as off-roader it dons the typical city SUV looks. I bought my Jeep Compass in January 2018 and till date, it never failed to impress me in one way or the other. Its amazing...Read More"," Apr 27, 2018 ",By Rishi,5.0,https://www.cardekho.com/user-review/jeep-compass/jeep-compass-attractive-design-and-amazing-performance-19459.htm
"Jeep Compass Attractive SUV That Misses Some Key Features
I started following all the updates on this small SUV the moment it was announced for the Indian market. The key reason behind purchasing this car was the attractive design with which I fell in love at the first sight. And since it is a Jeep product, I wasn't caring much about the build quality and the driving experience. The ride and handling of t...Read More"," Feb 13, 2018 ",By Ravinder,3.0,https://www.cardekho.com/user-review/jeep-compass/jeep-compass-attractive-suv-that-misses-some-key-features-19034.htm
"Indian Jeep Compass disappoints. The local sourcing is the spoilsport . Unsettled ride . Wayward steering. Horrible tyres , stalls frequently in second gear . The rear sharply thuds on speed breakers. Unhealthy side to side movement. The designer will faint if he drives Indian Compass. Sub standard parts to blame. Horrible quality checks"," May 04, 2018 ",By Tikka Bimbrahw Verified Buyer,1.0,https://www.cardekho.com/user-review/jeep-compass/horrible-ride-19492.htm
"Arrogant Staff Will Sink Jeep Compass
I am an Air Force Officer and was impressed by the Jeep 4X4 month offer and went to a dealer in Bangalore for enquiring about the same. I had carried my cheque book to book the vehicle in anticipation of an honest interaction with the sales personI first asked him about the CSD price list. He said that he doesn't have it. From the tone and tenour o...Read More"," Apr 20, 2018 ",By Ravindran Achuthan,2.0,https://www.cardekho.com/user-review/jeep-compass/arrogant-staff-will-sink-jeep-compass-19412.htm
"JEEP COMPASS- TRULY COMPACT
Overall, its a nice compact SUV. However, i would like to mention some comments basing on my experienced. 1. Cabin size, especially the height of the roof above front seats a bit low. 2. Bumper too low for hilly areas.Read More"," Mar 29, 2018 ",By Nokchasashi,3.0,https://www.cardekho.com/user-review/jeep-compass/jeep-compass-truly-compact-19295.htm
Great styling. Premium interiors. Ride quality is good. Great value for money. Goes well with the iconic brand name. Can compete with the cars of one level higher. Still have to experience service part though. Expecting good service network," Mar 03, 2018 ",By Deepak N,5.0,https://www.cardekho.com/user-review/jeep-compass/awesome-suv-19167.htm
"Worst Customer Service in Jeep Company and their Dealership
Worst Customer Care in the Jeep Dealership at dealer and when Escalated to Jeep Company the Response is even more Worse. There is no one to care for customers pain points. The basic elementries of customer installation on delivery is being ignored. The overall experience of Jeep has been very bad. Feeling very sad for having bought a Jeep. Product ...Read More"," Feb 28, 2018 ",By Prabhu,1.0,https://www.cardekho.com/user-review/jeep-compass/worst-customer-service-in-jeep-company-and-their-dealership-19153.htm
Diesel Engine is too loud in the cabin. Body frame sound is also there which is not acceptable with this segment of car. I purchased the vehicle from Dehradun and driven only 20000 km. I have been driving since 25 years and driven more than 25 brands of cars and SUV's .," Feb 19, 2018 ",By Sandeep Jindal,1.0,https://www.cardekho.com/user-review/jeep-compass/bad-than-all-other-indian-cars-19077.htm
"ultimate suv
kya khu iske bare test drive karo or kud jaan jao
what a break system, controlling power, curvings built quality,off road...
head off to jeep company jo aisi suv banayi....
jitna khu utna kam...."," Apr 18, 2018 ",By Pankaj,5.0,https://www.cardekho.com/user-review/jeep-compass/great-suv-19406.htm
"My friend recently bought the Jeep Compass and we got out for a small drive. As we drove down the highways, the car felt well planted and I didn?t have to switch gears very frequently in order to keep the car moving, which made it pretty relaxing to drive. But when we came back in the city, the heavy clutch started to get irritating and painful. The infotainment system offered with Apple CarPlay and Android Auto will not disappoint you but it would have been better if it had a large screen in place. I quite liked the car and I would like to get one myself but the unavailability of an automatic transmission is a deal breaker for me. I hope Jeep gets the automatic version soon so I can get one for myself."," Oct 24, 2017 ",By Saransh Goyal,4.0,https://www.cardekho.com/user-review/jeep-compass/good-car-but-lacks-automatic-transmission-18581.htm
