ReviewText,ReviewDate,ReviewAuthor,ReviewStarRating,Review Link
"The buying experience wasn't as expected. The car, however, was a different story. It has the looks which draw passerby's attention, very fun to drive due to the amount of power and torque available on hand. The build quality is commendable (both exterior and interior), far better than cars in the same segment. The numerous small features give a good feel. It gives around 12kmpl for daily city driving which is acceptable. The after sales service is a bit on the higher side and they don't provide free pick up and drop for the same, which all manufacturers do. Also, it hurts more as there are only two service outlets in Delhi and that too at different corners. Best car in its segment though."," Apr 19, 2019 ",By Nipun,4.0,https://www.cardekho.com/user-review/jeep-compass/true-to-its-jeep-heritage-53813.htm
"Awesome Car
Awesome car. Best SUV to drive in the price range. Built quality is very solid and a quick peppy engine."," Apr 17, 2019 ",By Kanishk Kandoi,4.0,https://www.cardekho.com/user-review/jeep-compass/awesome-car-53186.htm
"Lead the way
A beautiful machine to drive in. With power and smooth engine, you don't feel like getting out of the car."," Apr 16, 2019 ",By Shivam,5.0,https://www.cardekho.com/user-review/jeep-compass/lead-the-way-53003.htm
"Can't wait for you
I was impressed with the design. Still have a dream, that one day I will be the owner of this muscle."," Apr 16, 2019 ",By Edws,5.0,https://www.cardekho.com/user-review/jeep-compass/cant-wait-for-you-52917.htm
"Jeep compass limited plus is a very nice SUV. It looks like a muscular and top class car. The car's make and build quality is fantastic, you feel better during offroad. There are 50+ safety features in this car. There is a new feature of a panoramic sunroof, looks amazing. Car parking button is good."," Apr 10, 2019 ",By Anand Kumar,5.0,https://www.cardekho.com/user-review/jeep-compass/best-premium-suv-in-india-51595.htm
"Best car
Best car for Indian roads solid build and strong looks comprehends together to make the machine irresistible to watch, drive quality above any other in this price range. Happy to be an owner of the Jeep Compass. feeling proud of my choice.  Read More"," Apr 09, 2019 ",By Mayank,5.0,https://www.cardekho.com/user-review/jeep-compass/best-car-51314.htm
"I am using sport Bedrock petrol and it is felt that there is a serious lack of power thrust especially when you get a little rise on the road (going up from downside of the road). Also, Mileage I am getting in the city is around 8 KM/ L which is very poor compared to any other vehicle in this segment."," Apr 05, 2019 ",By Saroj Kumar,3.0,https://www.cardekho.com/user-review/jeep-compass/review-of-jeep-sport-bedrock-petrol-average-performance-50177.htm
Superb SUV. Its top 4×4 model is very cool. Its features are the best features among all the SUV's which I have reviewed. And its look is very perfect. Its colour combination is very good.," Apr 04, 2019 ",By User,3.0,https://www.cardekho.com/user-review/jeep-compass/best-features-49952.htm
"Superior car
Ultimate design , ultimate feature, comfortable seats and price"," Apr 26, 2019 ",By Ranjeet,5.0,https://www.cardekho.com/user-review/jeep-compass/superior-car-55279.htm
"I love this car
Awesome car. When we talk about the features so it has awesome features."," Apr 04, 2019 ",By Nilay Tandel,5.0,https://www.cardekho.com/user-review/jeep-compass/i-love-this-car-49717.htm
"Best and Favourite Car
Best for off-road and adventure and exploring new destinations."," Apr 01, 2019 ",By Nivedit Solanki,5.0,https://www.cardekho.com/user-review/jeep-compass/best-and-favourite-car-48967.htm
"Great Car Performance
It comes with great driving experience and with power, build quality of this car is best in its segment."," Mar 31, 2019 ",By Anonymous,5.0,https://www.cardekho.com/user-review/jeep-compass/great-car-performance-48771.htm
The car is feature loaded and comes with 2.0 litres turbocharged engine which gives you the power to ride. The suspension is best in class. Interior is awesome and the comfort level is up high. A real value for money car. The best thing is jeep has designed the car for India terrains. A very powerful and luxurious machine built to please the rider. I m a happy owner of the Jeep.," Mar 30, 2019 ",By Rishabh Rana,5.0,https://www.cardekho.com/user-review/jeep-compass/the-perfect-combination-of-power-with-luxury-48417.htm
"One of the finest SUVs that came across as searching for the right one. This one is a head turner and the performance is just amazing. Once u drive it, it's just you and the machine, just wonderful, loved the beast."," Mar 29, 2019 ",By Ahmed S,5.0,https://www.cardekho.com/user-review/jeep-compass/fine-suv-48213.htm
The ride quality and driving dynamics of the car makes this SUV feel like a sports hatch. Haven't had so much fun driving an SUV. The last time I had so much fun was in a first generation swift. The vehicle feels really planted and stable at triple-digit speeds on the highway. The fit and finish quality are excellent. The leather seats are one of t...Read More," Mar 28, 2019 ",By Aditya Balachandar,4.0,NA
"Great SUV. Top Of The Line
Best SUV in the segment! I'm in love with Jeep. It's really a head turner vehicle! Great Road appearance."," Mar 27, 2019 ",By Anonymous,4.0,https://www.cardekho.com/user-review/jeep-compass/great-suv-top-of-the-line-47751.htm
I will only say some words because there is nothing to say about the car. It's awesome we brought the car at 2018 July. It has six gear also 17tn 17+ average there service is also good the people are awesome. I will tell you that we were going to buy the Baleno.," Mar 26, 2019 ",By Kunal Pawale,5.0,https://www.cardekho.com/user-review/jeep-compass/good-car-47578.htm
"Compass - A Good Car
A good car with awesome pickup and performance, no need of speaking about comfort its awesome, all the time lovely to drive on highways and able to drive miles together without stress. I prefer automatic transmission in this vehicle because the manual clutch has some flaws and does not suit Indian road conditions apart of clutch every aspect is goo...Read More"," Mar 25, 2019 ",By User,4.0,https://www.cardekho.com/user-review/jeep-compass/compass-a-good-car-47018.htm
"Compass the Complete Compact SUV Car
Satisfied with all the variants. Driving comfort, Fuel economy, so much compact. Great Car."," Mar 24, 2019 ",By Bhadresh,5.0,https://www.cardekho.com/user-review/jeep-compass/compass-the-complete-compact-suv-car-46903.htm
"Roar Of The Lion
Amazing car with cool features and excellent look. The hydro blue color is a mind-blowing car."," Mar 24, 2019 ",By Sunita Kanwar,5.0,https://www.cardekho.com/user-review/jeep-compass/roar-of-the-lion-46825.htm
"Jeep is My Next Kid.
Value for money, looks awesome. Everything is designed keeping in mind all the aspects of the car. A must-have vehicle. Planning to buy soon."," Mar 24, 2019 ",By Dheeraj Kumar,5.0,https://www.cardekho.com/user-review/jeep-compass/jeep-is-my-next-kid-46702.htm
"Compass Feel It.
Best in class horsepower with great mileage. Head-turning exteriors with eye-catching iron man inspired headlamps."," Mar 21, 2019 ",By Shantanu Singh,5.0,https://www.cardekho.com/user-review/jeep-compass/compass-feel-it-45991.htm
"Best Car Ever.
This is the most excellent car ever in which I have traveled. The pickup is amazing. We drive our car on 180 which was really fast speed."," Mar 20, 2019 ",By Rishabh Jain,5.0,https://www.cardekho.com/user-review/jeep-compass/best-car-ever-45499.htm
"Jeep Compass is The Best SUV.
Jeep compass has superb comfort with high stability and fine control even at higher speed."," Mar 18, 2019 ",By Sam Mishra,5.0,https://www.cardekho.com/user-review/jeep-compass/jeep-compass-is-the-best-suv-44820.htm
"King of the road
Fantastic design, drives smoothly, amazing features, and also getting best engine sound."," Mar 15, 2019 ",By Anonymous,5.0,https://www.cardekho.com/user-review/jeep-compass/king-of-the-road-43622.htm
"The Ultimate Off-Roading Machine
Jeep Compass is undoubtedly the synonym of off-roading. Its strong built has no match. Indeed an ultimate machine."," Mar 12, 2019 ",By Vikram,5.0,https://www.cardekho.com/user-review/jeep-compass/the-ultimate-offroading-machine-42414.htm
"Go for Jeep Compass
Jeep Compass has superb comfort with high stability and fine control even at top speed. "," Mar 11, 2019 ",By Tanuj Vohra,5.0,https://www.cardekho.com/user-review/jeep-compass/go-for-jeep-compass-42055.htm
Such a brilliant diesel engine with adequate bhp takes you to the maximum speed experience with good road grip and great ambiance. Lovely machine. Thoroughly enjoyed driving the motor.," Mar 10, 2019 ",By Sivakumar Natesan,5.0,https://www.cardekho.com/user-review/jeep-compass/if-you-never-drive-you-never-know-the-beauty-41843.htm
"Ultimate driving experience, a lot of power yet smooth handling, so much control and confidence anyone can feel while driving in all driving conditions, whether it is bumper to bumper traffic at low speeds, or highway drive even on 150+ speed or off roads or bad roads. In each condition, the driving experience is full of fun."," Mar 08, 2019 ",By Dr Lalit Goyal,5.0,https://www.cardekho.com/user-review/jeep-compass/superb-car-41160.htm
"Awesome Jeep Compass
I have purchased my Jeep Compass in May 2018 and since then there is no turning back. The ride experience has been awesome."," Mar 07, 2019 ",By K Abhishek,5.0,https://www.cardekho.com/user-review/jeep-compass/awesome-jeep-compass-40633.htm
"Jeep Compass Limited plus
Bought this beast 3 months back. Performance in highways as well as off road is great. So much of power with great mileage and awesome built quality is amazing. You need to drive the compass to know it. Very much satisfied after getting my hands on it. Read More"," Mar 06, 2019 ",By Arshad Ahmed,5.0,https://www.cardekho.com/user-review/jeep-compass/jeep-compass-limited-plus-40505.htm
Jeep Compass is a brilliant car as it worth its price. It has such a solid body accompanied with elegant looks. It is a gem for an off-roader but as a coin has two faces the other face is that the Jeep brand lacks in service. ," Mar 06, 2019 ",By Jaskirat Singh,4.0,https://www.cardekho.com/user-review/jeep-compass/brilliant-and-worthy-car-40457.htm
"Jeep Compass is an amazing SUV, the experience in hilly terrain area was great. I'm satisfied with the budget and I'm waiting for new trail hawk to purchase. This is an amazing off-roader also."," Mar 05, 2019 ",By Rs Kashwal,5.0,https://www.cardekho.com/user-review/jeep-compass/jeep-feels-wow-40081.htm
"Unbelievable Jeep
The all-new Jeep Compass is hope for the SUV lovers. The engine of the car is very superb and the petroleum tank is also very big, it is the best car."," Mar 04, 2019 ",By Divyanshu,5.0,https://www.cardekho.com/user-review/jeep-compass/unbelievable-jeep-39557.htm
"Jeep Compass
Jeep Compass is the best car I have driven so far, excellent performance is also a great point."," Mar 03, 2019 ",By Mohamed Asif,5.0,https://www.cardekho.com/user-review/jeep-compass/jeep-compass-39274.htm
Pros -Build Quality like a military tank -Driving Experience -Interior Ambience -Road Presence -Jeep Branding Coming to neutral -touch screen response -Design of alloy wheels. Cons -Front flop below the bumper tends to touch as it very low to the ground you can remove it - The absence of automatic transmission in diesel," Mar 02, 2019 ",By S.jagadish Varma,5.0,https://www.cardekho.com/user-review/jeep-compass/jeep-compass-38841.htm
"JEEP COMPASS
Jeep Compass is a whole new concept...a beauty and also a beast with best in class speed, comfort, and engine. The best thing in the car is the noise cancellation inside the car and it's very smooth and also the best for off-roading. If you are looking for a car in a budget with best features, then you may buy this beast. Read More"," Mar 01, 2019 ",By Shivansh Arora,5.0,https://www.cardekho.com/user-review/jeep-compass/jeep-compass-38333.htm
"Jeep Compass
Jeep Compass is a great car and great looking. Everything is good in the Jeep Compass."," Feb 26, 2019 ",By Sagar Shinde,5.0,https://www.cardekho.com/user-review/jeep-compass/jeep-compass-37499.htm
"Jeep Compass
Jeep Compass is a very nice car, it is very smooth to drive. "," Feb 24, 2019 ",By Akshay Chauhan,5.0,https://www.cardekho.com/user-review/jeep-compass/jeep-compass-36964.htm
"Jeep Compass
Jeep Compass is the best features in 5 seater car in this segment. Nice and sporty look. It feels luxurious. The car is very comfortable and powerful."," Feb 24, 2019 ",By Aadil Khan,5.0,https://www.cardekho.com/user-review/jeep-compass/jeep-compass-36907.htm
"About Jeep Compass
I have just taken this car on January 20, 2019, .and it is working very well. I have given 4stars because very less feature compares to Toyota Fortuner."," Feb 24, 2019 ",By Satvinder Singh,4.0,https://www.cardekho.com/user-review/jeep-compass/about-jeep-compass-36810.htm
"Jeep Compass
Jeep Compass is smooth in running. It has a refined engine and its a perfect highway car."," Feb 23, 2019 ",By Yogesh Vyas,5.0,https://www.cardekho.com/user-review/jeep-compass/jeep-compass-36630.htm
"Jeep Compass
Jeep Compass is a superb car with extreme performance. 4x4 is perfect for this car, it is the best car in the medium range."," Feb 23, 2019 ",By Jitesh,5.0,https://www.cardekho.com/user-review/jeep-compass/jeep-compass-36477.htm
"Jeep Compass
Jeep Compass is a superb car, I'm using it for the last 8 months. It has massive power with all-wheel drive."," Feb 22, 2019 ",By Anubhav Mishra,5.0,https://www.cardekho.com/user-review/jeep-compass/jeep-compass-36434.htm
"What a engine?
This car has offered mind-boggling features. The interiors are premium. The offers have great competition for Creta and Harrier. After 2000 rpm this runs like a bullet."," Feb 21, 2019 ",By Aditya Bansal,5.0,https://www.cardekho.com/user-review/jeep-compass/what-a-engine-35950.htm
"The main highlight of Jeep Compass is its 170 BHP engine, which gives a decent mileage of not less than 14kmpl in urban conditions. DThe driving position is good and the seats are very good but the drawback is that the company should offer at least rear sensors for the above 20 lakhs vehicle moreover they are not offering floor mats. First service cost was around Rs 11,000 at 15000km. Tires are from Firestone and it is only rated average. Got 2 punctures within 10000km. Its good for driving passionate peoples. Its engine has a superpower and good pickup."," Feb 20, 2019 ",By Rameese Muhammed,4.0,https://www.cardekho.com/user-review/jeep-compass/jeep-compass-35693.htm
"Jeep Compass
Jeep Compass is a nice car. It has a great model and good performance."," Feb 20, 2019 ",By Mahfooj Ali,5.0,https://www.cardekho.com/user-review/jeep-compass/jeep-compass-35636.htm
"Jeep Compass
Jeep Compass is a very nice car. A car with good mileage and having that much of power of 173 bhp and even less noise inside the car."," Feb 23, 2019 ",By Chaitanya Vr,5.0,https://www.cardekho.com/user-review/jeep-compass/jeep-compass-36493.htm
"It's a good car, I would not say its perfect but ya good, not a value for money product. Its limited plus variant is too costly, but the power of the engine is superb, The interior is luxurious and it does have some road presence."," Feb 22, 2019 ",By Shreyansh,4.0,https://www.cardekho.com/user-review/jeep-compass/jeep-compass-36152.htm
"Driving a Jeep Compass is an addiction, such power and flawless drive makes it an absolute delight. Additionally, its tank-like build quality and safety makes it live up to the Jeep brand."," Feb 20, 2019 ",By Raghav Mundra,5.0,https://www.cardekho.com/user-review/jeep-compass/jeep-compass-35552.htm
"Jeep Compass
Jeep Compass is real love. It has the thrill to drive with comfort, smooth gear shift and best pickup. "," Feb 20, 2019 ",By Ravi Chaudhari,5.0,https://www.cardekho.com/user-review/jeep-compass/jeep-compass-35548.htm
"I bought a Jeep Compass Limited Plus last week. Oh God, what an SUV it is. A perfect blend of killing looks and beasty power. It is so comfortable to drive and made for enthusiast drivers. I'm loving it."," Feb 19, 2019 ",By Vivek,5.0,https://www.cardekho.com/user-review/jeep-compass/jeep-compass-35182.htm
"Jeep Compass
Jeep Compass has a nice exterior design, this compact SUV is an attractive one in its segment. "," Feb 17, 2019 ",By Saleek Salee,5.0,https://www.cardekho.com/user-review/jeep-compass/jeep-compass-34806.htm
"Fantastic car
Fantastic SUV to drive long and rough surfaces. Loved the design and performance."," Feb 17, 2019 ",By Nisham,4.0,https://www.cardekho.com/user-review/jeep-compass/fantastic-car-34768.htm
"JEEP COMPASS
Jeep Compass is a very good SUV but the problem is that the rear seats are uncomfortable."," Feb 15, 2019 ",By Ram Sharma,4.0,https://www.cardekho.com/user-review/jeep-compass/jeep-compass-34352.htm
"Jeep compass has excellent mileage
 I got Jeep Compass, it is really outstanding the mileage is just 20.5 km/l only at 90km. It has super control at 140, overall I love Jeep till now I had the best experience but the service centres are not up to the mark. Jeep have to work more on this but no complaint on Jeep Compass SUV Read More"," Feb 14, 2019 ",By Manpreet Singh,5.0,https://www.cardekho.com/user-review/jeep-compass/jeep-compass-has-excellent-mileage-34036.htm
"Jeep Compass is the best SUV
Jeep Compass has a stylish body and upscale SUV with real long lasting rough and tough quality. It comes with high safety standards and true SUV for off-road."," Feb 14, 2019 ",By Priyam,5.0,https://www.cardekho.com/user-review/jeep-compass/jeep-compass-is-the-best-suv-34021.htm
"Jeep Compass
Jeep Compass is a bad car, it is not perfect for Indian road and the maintenance cost is very high."," Feb 13, 2019 ",By Kamaljeet,1.0,https://www.cardekho.com/user-review/jeep-compass/jeep-compass-34007.htm
"Jeep Compass
Jeep Compass is a bad car, it is not perfect for Indian road and the maintenance cost is very high."," Feb 13, 2019 ",By Kamaljeet,1.0,https://www.cardekho.com/user-review/jeep-compass/jeep-compass-34006.htm
"In a country obsessed with features, we often forget how a car isn't just a tool to get you from one point to another. It's how you get there. This car does everything and once you find a good stretch of road, you'll know why."," Feb 02, 2019 ",By Chris,5.0,https://www.cardekho.com/user-review/jeep-compass/best-drivers-suv-in-the-bracket-30737.htm
"The stylish jeep compass royal compass
This car is so beautiful and wonderful the interior is amazing and the exterior is also nice and this is the best SUV forever and good looking car and it is important car and royal car it is my dream car The Jeep Compass very nice car and stylish also and the front design also very good and the sunroof is amazing really I appreciate this car from b...Read More"," Jan 29, 2019 ",By Rizwan Baligar,5.0,https://www.cardekho.com/user-review/jeep-compass/the-stylish-jeep-compass-royal-compass-29763.htm
"The best in its segment!
This is easily the best car in its segment with that 170 horsepower, 2.0L diesel engine producing 350Nm of peak torque. This is one of the best driver's car."," Feb 12, 2019 ",By Parikshith D,5.0,https://www.cardekho.com/user-review/jeep-compass/the-best-in-its-segment-33515.htm
"Jeep Compass is the best
Jeep Compass is the best SUV in Segment it's just phenomenal in price."," Feb 11, 2019 ",By Achieve Raghuwanshi,5.0,https://www.cardekho.com/user-review/jeep-compass/jeep-compass-is-the-best-33062.htm
"Jeep Compass really a nice car and its interior are awesome. It's leather seats are really good, it's designed airbags all are very amazing. I wish Jeep keeps on making such awesome cars."," Feb 10, 2019 ",By Nishant,5.0,https://www.cardekho.com/user-review/jeep-compass/jeep-compass-32979.htm
"Love Jeep Compass
Jeep Compass is just amazing where all the features are good enough for the common man."," Feb 08, 2019 ",By Vikas Singla,5.0,https://www.cardekho.com/user-review/jeep-compass/love-jeep-compass-32348.htm
"It is a beast
I have Jeep compass 2017 which can drive perfectly on any type of road, such as plane road, sand road, mountain and also in a desert. I just love it."," Feb 07, 2019 ",By Sarthak Bansal,5.0,https://www.cardekho.com/user-review/jeep-compass/it-is-a-beast-32176.htm
"I purchased the Jeep Compass Diesel Limited Option model in 2017, I choose to purchase the Jeep for its Safety Features and so I bought the Top-End model, All was going well until Dec 2018 but one night of Dec 2018, I met with an accident. I was driving Jeep Compass with my friend at a speed of about 80 to 100 km/hr on this freeway suddenly my right side front Tyre faced a problem and the car was going to its right side at same speed I tried to control it and pulled my steering towards left side and the car struck to a divider and the impact was so strong that I, my Friend and the Car all were upside down. It slid about 150 meters. Due to Seat belt on me and my friend were safe with injuries on the chest. The main thing after the accident is that I called Jeep 24/7 Customer Care, The other problem was that due to this high impact accident and the car was upside down but the Air-Bags didn't open at all and so I was seriously hurt on my chest. I had an issue that why my Air-Bags didn't open. Although I purchased the Topmost model of the car."," Feb 03, 2019 ",By Nayan Bhagat,1.0,https://www.cardekho.com/user-review/jeep-compass/shaft-problem-30882.htm
"Phenomenal car..!!
Most satisfying car. Under this money bracket. Proud to be an owner of JEEP COMPASS LIMITED PLUS..!! &#x1f60e;"," Feb 01, 2019 ",By Arpit Singh,5.0,https://www.cardekho.com/user-review/jeep-compass/phenomenal-car-30359.htm
"About the car
This car is a very accurate car range. I think this is the evolution in cars. The car is a feature loaded masterpiece by JEEP."," Feb 01, 2019 ",By Sumit Vasisth,5.0,https://www.cardekho.com/user-review/jeep-compass/about-the-car-30196.htm
The most attractive point is designed like a luxurious model series like Benz and affordable price range love this car to buy even middle and rich class people's. The car is insanely awesome SUV.," Jan 26, 2019 ",By Aribaskar,5.0,https://www.cardekho.com/user-review/jeep-compass/branded-car-better-to-say-its-a-golden-star-29373.htm
"I have bought JEEP Longitude (O) with paid Mopar Maintenance Package by August from an authorised showroom in Coimbatore. Poor Sales Team, no knowledge on the Car itself (lol) next is about Variants. Cheating on Money. I didn't get the Invoice for the Value that I have paid. Insurance amount has been doubled than the actual Insurance JEEP has provided upon Purchase. Poor After Sales support. Poor Customer support. Unfit JEEP Management. Useless of saying themselves as a Premium Brand. I have paid for INR75,000/- worth Mopar Maintenance Package along with my car which includes additional 2 years Roadside Assistance, 2 years of Extended Warranty and 5 years of Free Maintenance. Jeep provided only Extended Warranty and didn't provide me with the Rest 2. It's been almost 5 months, despite continuous follow-ups. Jeep is very Reluctant in the Issue and no one cares on this Issue. ISSUE MAY BE ANY BUT THERE SHOULD BE A PROPER RESPONSE FOR THE MONEY PAID and I don't understand why are they calling themselves as a premium brand. It's like, I HAVE BEEN CHEATED."," Jan 28, 2019 ",By Arunprasath,1.0,https://www.cardekho.com/user-review/jeep-compass/be-cautious-while-you-buy-jeep-29611.htm
"Best Suv of india
Awesome car at a good price. It is a good looking, affordable car. It is the best SUV with awesome features."," Jan 26, 2019 ",By Sumit,5.0,https://www.cardekho.com/user-review/jeep-compass/best-suv-of-india-29381.htm
We bought our car on the 22 November 2018. We got the limited plus 4*4 variant. Exactly 1 month later we went on a road trip from Kolkata to Rajasthan and the car performed brilliantly. There were some parts where no other car could go but it went flawlessly without a problem.," Jan 24, 2019 ",By Yash Raj Jain,5.0,https://www.cardekho.com/user-review/jeep-compass/the-king-of-the-road-28744.htm
"It's like on roads
The Jeep Compass is an awesome car with awesome safety features, It comes with 4 wheel drive, 4 wheel disc brakes, wide sunroof and the car looks amazing"," Jan 23, 2019 ",By Sunny,5.0,https://www.cardekho.com/user-review/jeep-compass/its-like-on-roads-28577.htm
"I have bought jeep compass automatic in January 2018 my car is broke down exactly 375 days from delivery due to a battery problem. The company has given 3 years warranty on the vehicle, but battery (Exide) fitted in the car is very low quality and service center guys say only one year guarantee for Exide battery and you have to pay for it. The Exide battery dealers are giving 30 months replacement guarantee for same battery, jeep company is compromising with the quality for the battery which is not advisable, and the rear seat is torn due to low quality."," Jan 22, 2019 ",By Umesh Shetty,1.0,https://www.cardekho.com/user-review/jeep-compass/bad-quality-of-battery-and-rear-seat-28367.htm
"Great experience
Nice car to drive on highways and best handling than other cars at high speed."," Jan 17, 2019 ",By Aditya Karande,5.0,https://www.cardekho.com/user-review/jeep-compass/great-experience-27932.htm
