ReviewText,ReviewDate,ReviewAuthor,ReviewStarRating,Review Link
Riding experience I'm excited I didn't compare any another car.just I'm traveling to 85km and driving my friend car so good.this road was not a good means soil car moving very smoothly driving control is a awesome Jeep Compass . ... Nice car awesome very stylish.On the inside the Jeep Compass packs an equally good.I'm really miss you,08-Nov-18,Iyyappan,4,https://www.carwale.com/jeep-cars/compass/userreviews/60556/
It is a super car ever i have seen in my life yet and hope it should be a great car amongst all in its range and design. Hope one day I'll get one for me one day. Amazing is never so according to your pocket size.,24-Mar-19,Shivesh,5,https://www.carwale.com/jeep-cars/compass/userreviews/85390/
This is such a very beautiful car and has lots of great features.performance is also very good.it feels like sitting in a very premium and luxury car.if we talk about maintenance that is not as much as many cars have.,18-Apr-19,Paras,5,https://www.carwale.com/jeep-cars/compass/userreviews/88206/
"Exterior Exterior looks stylish like cherokee. seven grills look fabulous.It does look smaller in some angles but if you view it from the side it looks bigger. Metallic gey is nice,Black colour is the best it looks bigger and red with black hood is quite cool.
Interior (Features, Space & Comfort) Interior is quite nice.Front leg room is good and we can view the road easilyI personally didnt like the white colours as they can get bad.didnt like the dummy buttons in steering. Also it would have been nice if there was a lock for changing between drive modes (mud, sand) because i have been told that if you do that while drriving the engine might get bad.
Engine Performance, Fuel Economy and Gearbox Awesome pull in the high ranges.Fuel ecnomy is very good. While driving with AC on you get 14 kmph else you get 17kmph. The best part is gearbox although the clutch is a little low shifting is so easy.
Ride Quality & Handling It is as if I am riding a car having good ground clerance. Handling is swift.It has lesser turning radius.
Final Words Jeep better than all among competitors.Stylish comfortable you name it. I think I am going to see them a lot in the roads.Hope the service network also does with the expectations.
Areas of improvement NA.
Exterior,Power,Mileage,Battery chargeInterior white colour,Dummy buttons,Google maps built in",31-Oct-17,Dony,4,https://www.carwale.com/jeep-cars/compass/userreviews/49295/
The Jeep compass SUV is very great. The car is exterior interior mileage and pickup is very excellent and suggested that compass value for money this is SUV if I have 15 lacs rupees that I will purchase it is SUV and I Jeep compass is god gift for company because every moment light to you thank you,07-Feb-19,Aniket,5,https://www.carwale.com/jeep-cars/compass/userreviews/76688/
"This car is well built with all available features, but something missing, ya its Middle rear three point seat belt, driver knee airbag and hill decent control. Its sporty and catchy.",17-Jun-19,Anand,4,https://www.carwale.com/jeep-cars/compass/userreviews/95124/
I BROUGHT THIS CAR LAST YEAR AT 8000 KMS BATTERY IS GONE AND BELIEVE AT 18000 KMS CLUCH PLATE IS GONE AND THEY REPLACED NOW YESTERDAY AT 25000 KMS AGAIN CLUCH IS GONE AGAIN THIS IS JUST A SHOW OFF VECHILE USING THE BRAND NAME JEEP LOT OF CUSTOMERS ARE FACING THE SAME PROBLEM U WILL BE BYING THIS CAR WITH GREAT EXPECTATION AND U WILL BE SEEING HELL OUT OF IT,27-Mar-19,Narasim,1,https://www.carwale.com/jeep-cars/compass/userreviews/85655/
"I can't say anything about jeep compass I don't know what to write about jeep compass The only way to feel jeep compass is to drive that car. That make you to scene the power, feel ,and the last but not least the performance and comfort Hata off to the designers of Jeep compass??????????????",02-Feb-19,Lovedare,5,https://www.carwale.com/jeep-cars/compass/userreviews/75929/
"I bought my car from Jeep store @omr RDC royale on Januar 4th 2018. The buying experience was good barring a couple of days delay. They even arranged for the pujas to be done prior to taking delivery of the car. I was very thrilled to take it on the highways, but had to wait 3 months for that to happen. And finally when the day came it was all the more exciting. The sheer torque and the power of the car made it feel like flying on the highways. The steering was always in control even at 170 kmph. The car felt well grounded at high speed overtakes and on the straight line too. One thing i was really disappointed with was the mileage which i got only 12.5 kmpl even on the highways. My hometown doesn't have good roads as we see in the metros, but my Jeep was able to tackle all the bad patches. With ease, which is a testimony to the ride quality of the car. Although everything was going good, when i was returning home from a long drive i noticed that the ESP warning had started glowing. That is the only problem i have faced with the vehicle till now. Although i was disappointed with this problem, i feel its a minor issue and would be sorted out easily. Hoping for a million miles journey with my beast.",16-Dec-18,Sriram,4,https://www.carwale.com/jeep-cars/compass/userreviews/67482/
The best jeep with safety and performance .. I work @ Jeep Calicut Kerala. I have never experienced this kind of awesome drive never before. You will feel safe when holding the steering wheel. Pure power with safety. please note that my remarks are not based on me working for Jeep. I am in love with This Jeep .. the only coz of the safety features it gives you,24-Jan-19,Nidin,4,https://www.carwale.com/jeep-cars/compass/userreviews/74139/
Battery had to be replaced in 13 months. After sales service of Vadodara dealer not up to expectations or promise given by the sales people. Do not have drivers to pick up or drop. While selling it was promised. So dropped the idea of adding one more Jeep ( Diesel AT).,09-Jun-19,Shaji,3,https://www.carwale.com/jeep-cars/compass/userreviews/94109/
"I think this the best car for every one and the look of this car is totally different from the other cars and interior and exterior is amazing safe and durable I think I am in love with this car yeah I love this car I want to purchase it actually I drive it I love it, it's performance is very good strearing is very smooth this is a gift to all jeep compass fan or clients and the engine of this car actually fabulous outstanding no noise and pickup is very good,sunroof is totally automatically of jeep compass and its quality is very good hard and expensive I just love this car I want to buy it but one day I will purchased it,safety features are very good and there is no comparison with their clients jeep compass provided best facility to there clients",22-Feb-19,Kuldeep,4,https://www.carwale.com/jeep-cars/compass/userreviews/79774/
"Buying experience: Actually I choose Duster in that time. But mY friend suggest this for me and I just look at this, but I love this. Bcz its soo comfortable in size and much better power.
Riding experience: just one word... go like an sporty FAMILY",05-May-19,TOMILIN,4,https://www.carwale.com/jeep-cars/compass/userreviews/90014/
Riding experience is very good and amazing buy this car and enjoi your life 100 percent guarentee It is provideamazing riding experience in especially highrange areas .. Wondrfull milage and comfort journy provide this vehicle im also enjoi this vehicles innerspace that challenging other type of vehicle,02-Jun-18,Irshad,5,https://www.carwale.com/jeep-cars/compass/userreviews/56222/
Riding experience the car was amazing gear shift is better feel and interior and exterior wonderful and the driving experience is super totally the car is mini rolls royals cullinan,30-Jul-19,Sunil,5,https://www.carwale.com/jeep-cars/compass/userreviews/100256/
"Jeep Compass is something new suv car and good quality of drive. It preferable for road and off road both. Also it had an attractive look and comfortable feels in driving and safest car on this segment. Its seem young generation car. Finally I can say something like this ""tease the car and feel the heat"".",04-Jan-19,nuthan,4,https://www.carwale.com/jeep-cars/compass/userreviews/70308/
I got delivery before time. Very nice and polite staff in mumbai landmark. Ride quality is very very excellent. About other dealers I don't know. But in landmark mumbai very good staff. After sales also service is very good. After buying u want repent. Better than any other suv in that segment. Very strong and durable,01-Aug-18,hired,5,https://www.carwale.com/jeep-cars/compass/userreviews/56740/
It is the trmendous car with fabulous interior.A luxury feeling comes while driving this car.It met my all expectatations.It is tremendous car at affordable price.The exterir is also fantastic,11-Jun-19,shamiqshafi,5,https://www.carwale.com/jeep-cars/compass/userreviews/94374/
"The buying experience wasn't really nice because the dealers knew nothing much about the car at all but when it comes to performance it's got a fiat engine after all Italian hence it really gives you the luxury feel and power at the same time, looks wise is really aggressively attractive no doubt. I think they have put in some satisfying power for an SUV and the only cons is the low clearance as I stay in a state where the roads are really uneven in certain areas hence it still hits the front bumper but I mean big potholes it would have been great if it was design in 18 inch tyres too maybe. Overall No regret for the version I bought Limited Option 2.0 Diesel. Truly American :)",21-Apr-19,Eurika,5,https://www.carwale.com/jeep-cars/compass/userreviews/88487/
Very good car good for long drive journey with family and comfort is quite good not bad the looks of the car is nice and the smoothness of the car is very good on bad roads maintenance is not good,22-May-19,Ithikap,5,https://www.carwale.com/jeep-cars/compass/userreviews/92071/
Pros n cons Look wise it’s muscular stylish. We bot Compass limited petrol at on road it almost rch 25lakhs. But really sorry to say that it doesn’t have any basic freatures which provides in Hyundai Elantra Sx model. Driver seat adjustment it’s like ordinary style. That disgusting. Interior look very cheap. Rear seat is not comfortable for a long drive. Comfort wise Hyundai creta is way better. It’s a plastic car I would say. Nothing other than looks. Their is no music adjustments on steering wheeel. Really disappointed we dint go for a test drive. That we trusted jeep so much 3/10.,14-Nov-18,Meena,2,https://www.carwale.com/jeep-cars/compass/userreviews/61866/
"Buying experience: I feel pleasure when I see the car moving in road
Riding experience: I feel so comfortable.....It goes smooth in all roads
Details about looks, performance etc: Riding experience is very smooth
Servicing and maintenance: I haven't left any service. Till this day...once I left for service I will review
Pros and Cons: I love the interior... Air conditioning service is marvelous..",25-Mar-19,Nitheesh,4,https://www.carwale.com/jeep-cars/compass/userreviews/85419/
"First of all thanks to car wale for helping me to decide and short list the car i wanted. I have gone through the reviews, which were not that good before buying this beast. I took a call and bought limited plus edition. Its a wonderful car. You can compare this with audi q3. The comparison of this car is not at all with creta top end or xuv500 or tata harrier, this car stands apart. Had gone upto 170km/hr but still the vehicle was under my control. Ride and handling is excellent. The NVH level is well within control. Mileage should be more than 10 as i have driven only 500km and each time there's an increment in mileage. Music systen is good. 5 persons with weekend luggage can accommodate easily.",03-Jul-19,Shekhar,4,https://www.carwale.com/jeep-cars/compass/userreviews/97195/
The colour Red says it all . It looks beautiful in every way possible .technically is is very sound and feels like so peaceful . Indeed one of the best looking SUV . An Suv to die for .,04-Jun-19,Angad,5,https://www.carwale.com/jeep-cars/compass/userreviews/93620/
The car is very good.the praise is less than it is that such a car is not available anywhere os very concrete and i want to tell you there is a car too.i felt the best look in this car,20-Mar-19,Hritik,5,https://www.carwale.com/jeep-cars/compass/userreviews/84917/
"Having good experience with this car , nice features,good pickup, high level of comfort,engine performance is also very nice,i can say that its a value for money in that range......",07-Feb-19,Pankaj,5,https://www.carwale.com/jeep-cars/compass/userreviews/76726/
Bought from sky Moto n had very good experience with them specifically Mr Kapoor was very helpful. Good ride quality but suspension r little on the harder side. Very good built quality. The reason for giving 3 starts is because Indian variant misses lot's of features as compared to international models.,02-Feb-19,Manoj,3,https://www.carwale.com/jeep-cars/compass/userreviews/75960/
"Buying experience: Professional sales approach at landmark jeep Gurgaon,Timely delivery..
Riding experience: Powerful, Confident Driving Experience.Great Pickup. Bit hard on clutch.City conditions is giving me a milage of 15 kmpl approx..on Highway I have noted 19 to 20 kmpl also.
Details about looks, performance etc: I will rate it great on looks except the light colour interiors in limited edition..which I doubt is a good idea for Indian conditions.
Servicing and maintenance: Have done 10k on the clock.Have just visited once for routine checkup..Feel it is bit overpriced on service..Simple checkup n greasing costed me 2500 approx which should have been free,as most of the brands do it for free..I think simple servicing will be in double digits..Also very limited options on service centres
Pros and Cons: Pros Best in class with engine specs. Great Build Quality Good Milage Good Infotainment Silent and compact cabin experience Cons Bit overpriced on every patient..should have been between 12 to 18 lacs exshowroom Light interiors Hard clutch No automatic in diesel No cruse control though useless feature to have",02-Mar-19,Sachin,5,https://www.carwale.com/jeep-cars/compass/userreviews/81337/
"Buying experience of Jeep compass sport model is too good because it is the base model of Jeep compass starting from 15 laks onwards. Riding experience of this model is a top notch in both city and highway but on highway is a great cruiser. The body roll of Jeep compass is outstanding around the corners and stability is also outstanding on the highways and which is the best in the segment. This is the only petrol SUV comes with maximum power around 161bhp and highest than its rivals. Looks of Jeep Compass is the best in its segment with seven slat grille with commanding design, looking dynamic and looks sportier. Performance is outstanding with 1.4 litre petrol engine because it drives smoothly, punchier and nicer to drive. Jeep compass petrol mileage around 15 to 16 kmpl on the highways if you drive not too much fast and in city 10 to 12 kmpl. Servicing and maintainence of compass is reasonable and not much expensive in petrol variants while in diesel it is too expensive to maintain the vehicle and while servicing cost is expensive. PROS: 1. It comes with safety features such as EPB, ESP, Hill Start Assist, Roll Over Mitigation, All Disc Brakes, Traction Control and Hill Descent Control as standard. 2.) 6 speed manual gearbox is joy and easy to use. 3.) Class leading off road capabilities. 4.) Build quality and interior quality is a top notch and best in the segment. 5.) Plastic quality and materials are used on the compass are extremely superb and best in its class. 6.) The individual suspension set up of the compass which further increases its off-road capabilities. CONS: 1. Missing some features like cruise control, electric ORVM turn indicators, alloy wheels and other features etc. 2. Poor rear seat comfort and feels cramped for three adults. 3. The petrol engine is noisy than the other rivals like creta and hector. 4. Too pricey 5. The brakes are good, but while slowing down from high speeds it seems to lack the necessary bite for sharp and effective braking. 6. 7 speed DCT automatic transmission is not very smooth, quickest, lacks punch and feels jerkiness on the highways.",30-Jul-19,Vineet,5,https://www.carwale.com/jeep-cars/compass/userreviews/100281/
Jeep compass is luxurious SUV in marker peakup is very good and Jeep compass look very sexy and other hand performance in is excellent 7.6sec me 100km speed much better than other brand??????,16-Feb-19,Aryan,5,https://www.carwale.com/jeep-cars/compass/userreviews/78525/
Realy awsome vehicle realy exited with drive the car very nice and comfortable .look like heavy rich vehickleand stunnish look and nice driving experiance realy i like the jeep compas,01-Jul-19,Shijutaj,5,https://www.carwale.com/jeep-cars/compass/userreviews/96957/
"I love this car very much about the technology used in this .the powerfull engine and torque releases,etc The design of front is sooo awesome as we are seeing A small Hummer like SUV. This is having different types of modes,a smooth and elegant designs in de interiors,as well as comes to exterior colours they are also very excellent colour too",06-Jan-19,Uday,4,https://www.carwale.com/jeep-cars/compass/userreviews/70846/
"not buy, but I drive this car.so comfortable. It looks amazing. service and maintenance don't know cause this car is not mine. I will sure buy this car in future. It's a good car.there are no negativities.",07-Feb-19,Aniruddha,5,https://www.carwale.com/jeep-cars/compass/userreviews/76737/
It is a splendid vehicle. It gave such a nice drive I loved it .its having the special 4*4 and it make the smote ride in Kerala and its make the trip very well in most of the road conditions and gives most opportunities to safety and security in our life .,11-Mar-19,Moideen,5,https://www.carwale.com/jeep-cars/compass/userreviews/83137/
"I have always been a fan of the Compass since it was launched back in 2017. Being a student and a big car enthusiast, it was really hard to convince my parents to choose this car over the Creta (There was a 5 lakh rupees price difference!). Recently, my best friend got the newly launched Sport Plus 1.4 Petrol variant of the Compass(Harrier effect, maybe?). And I must say, I wish my family had waited for this. He surprisingly agreed to take the Compass for a road trip to Rishikesh which we've been planning for days and I got to drive this beauty for quite a while to write this review. Under the hood, this two-wheel-drive car packs the same Fiat-sourced 1.4 litre turbo petrol engine producing 160 bhp of power and 250 Nm of torque which we've already seen in the top spec variants. The car is loaded! We get 16 inch Alloy wheels, roof rails, dual zone automatic climate control, a 5 inch touchscreen infotainment system with 4 speakers and all the standard safety features along with the signature electronic parking brake. One more thing, there's a hidden easter egg near the bonnet of the car and it's just better that you notice it yourself. Some people might find the infotainment unit smaller compared to the 7 inch one seen in higher variants, but not us! It doesn't have a stock rear parking camera, but you can install that as an accessory. The speakers work really well. Also, conventional headlamps are provided with this variant and there's no sunroof on offer. Now let's talk about driving this beauty. This car, is a beast! The turbo kicks in after 2300 rpm and you get that kick in the pants feeling. This car crushed all the bad roads which we encountered in the hills. Although the suspension is a bit on the stiffer side, body roll is negligible and the Compass feels so much alive when you're cruising through those corners and the brakes work very well. Arguably this variant, the Sports Plus, will give you the most bang for your buck. It packs all the necessary features, and even more! This is a proper driver's car with much practicality on offer. Priced at 15.60 lakhs ex-showroom, I would definitely recommend this Compass to all the interested buyers in this segment. Definitely a 5 star rating from my side!",14-Jun-19,Kashish,5,https://www.carwale.com/jeep-cars/compass/userreviews/94658/
Its a dream car for any man..i love the way it moves in highway.. 175 BHP cant compare to any other vehicle in this segment..solid body..music system is too good..i wanted to buy top most model but waiting period was 3 months so opted for limited option..no regrets..just go for it guys happy motoring...:),27-Feb-19,satish,5,https://www.carwale.com/jeep-cars/compass/userreviews/80836/
"Buying experience: Good And very comfortable. Nice color
Riding experience: Comfort And good well designer car
Details about looks, performance etc: Very good performance and drive too
Servicing and maintenance: Lower maintains car this is. So good
Pros and Cons: All things are very good and seriously",02-Apr-19,Hind,5,https://www.carwale.com/jeep-cars/compass/userreviews/86212/
"Cons :There is lac of some basic features like 7inch touch screen and electronic adjustable seats ,sunroof etc. The most important thing to notice is no automatic version in diesel it only comes in diesel manual . According to the price it lacs some baisc features which come standard in other brand cars.",03-Dec-18,Its,4,https://www.carwale.com/jeep-cars/compass/userreviews/65221/
"Buying experience is excellent, it feels I'm part of a big brand, riding experience is the best part of the car drive well good economy and very less amount of body roll, top speed performance of car is mind-blowing can be reached to 220km/hr, the car have all necessary jeep traditional elliments, front of differentiate it from all other brand ,very eye catching, best part is build quality very single time I close the, feel the weight and the thumb sound of the great build, servicing is good less than I expected, Americans know for there high service cost, but jeep has managed it well, I wish the second row should be more declined soo it become more comfortable",19-Jun-19,Ashutosh,4,https://www.carwale.com/jeep-cars/compass/userreviews/95430/
"This car is for people who love adventure in their life .This car make me feel that I am driving it up in the sky. Wherever I go I only listen good comments about it ,it makes me feel nice",18-Jan-19,Raj,5,https://www.carwale.com/jeep-cars/compass/userreviews/72904/
Its an amazing car......Loved it...and also its body is so beautiful even though I fall in love with that car......The most complete and best thing is the dashboard its.....absolutely amazing .....I think it should be the best car of the year 2018..........I hope that Jeep company will make also a new beautiful car...in future,06-Mar-19,Pokémon,5,https://www.carwale.com/jeep-cars/compass/userreviews/82120/
"Staff at My dealer Eldee Motors was friendly and well conversant with details.. Best part about this car is it’s smooth drive.. it’s a treat to do long distance ., I got a mileage of 16.9 kpl ( Allahabad to Chamba and back ) 3040 kms Miss the automatic in hill section and city though. Bumper to bumper traffic means gear one. Otherwise superb car Loving every moment with it",22-Jun-19,Vinay,5,https://www.carwale.com/jeep-cars/compass/userreviews/95691/
"1. I was interested in Creta but When I saw Jeep Compass, I was more interested in that.Did A Test Drive And Booked It. An Amazing Experience 2. Ride Quality is just awesome. Take a turn at 120 but you don't feel it . True feelings of a sedan level comfort in a SUV. 3. Looks as seen is great overall.While Performance is good , It is Priced 25 lacs , 10 lacs under the fortuner but gives out performance better than fortuner. 4. Drove it 6500 Kms , service cost is less . Cons Features like Cruise control are missing. Pros Performance 4x4 Comfort level Ride Quality Power Maintenance cost",26-Sep-18,Nakul,5,https://www.carwale.com/jeep-cars/compass/userreviews/57548/
"Jeep is first vehicle launch all over the seven continents I just drive this machine few days back, I feel what is real safety & comfort in a car, The answer is Jeep Compass. At 120 km/hr speed extremely fell what is traction control safety measure. For long drives J C is very good in off road or on road. People those who prefer safety more, JC is the answer.",17-Feb-19,Eldho,5,https://www.carwale.com/jeep-cars/compass/userreviews/78541/
1. I cant buy it because of its high rates.. we have see it drove it n because of its high rate i cant buy it i want 15 to 17 lakh cars .. bt i have taken a test drive.. 2. Too good n i have impressed with this car .. liked it most .. its just like m favourate one 3. Look its best than other car .. performance is also best n good interiors too 4. I dont have an idea about servicing n maintanance .. bt i ask the dealer abut servicing he told us 12k to 13k & its also too high.,15-Dec-18,Sahil,5,https://www.carwale.com/jeep-cars/compass/userreviews/67278/
Amazing one... With less price good quality... Best car.... I have ever seen... Buy it as soon as possible... It will be a best benefit to the buyer... Its a good car dont hesitate to buy it.... Go on,26-Feb-19,Chetan,5,https://www.carwale.com/jeep-cars/compass/userreviews/80592/
"Buying experience: Good very easy to handle a new varient car
Riding experience: Nice travelling it gives more comfert and not give much more pain to hands
Details about looks, performance etc: Hood look good performance and powerful engine and good look nice polishing.
Servicing and maintenance: Its too bad because not good service centrers
Pros and Cons: Good it a good car which can control easily.",21-Mar-19,Rahul,4,https://www.carwale.com/jeep-cars/compass/userreviews/84944/
