ReviewText,ReviewDate,ReviewAuthor,ReviewStarRating,Review Link
"As and when Compass comes with AT 4x4 it will cost atleast 23.5 and obviously as it is a new launch there are no discount offers. Tucson with discount offers between 1-1.5 L is going to be available for almost the same price as the AT 4x4 Compass. Therefore a Tucson which is bigger, more powerful, more fuel efficient, better dynamically designed, more reliable, better ASS network, better looking ( depends on ones own taste), drives more like a sedan ( most of ones driving is going to be on metalled roads), needs serious considerations.As far as brand value (snob value ) is concerned worldwide Hyundai sells more Tucson than Jeep selling compass and has better ratings.In fact Jeep products are at the bottom of the rung. Now the present compass may be a new vehicle and may behave differently but it is still untested. A short test drive is not enough to test a vehicle which is going to cost more than 25 L.
We Indians need to think more with our brains than our heart. A known enemy is better than an unknown friend.
Folks it is your hard earned money. You should get the best value for it.
And it is you who has to decide, finally."," Oct 19, 2017 ",By Romesh Lal,3.0,https://www.cardekho.com/user-review/jeep-compass/4x4-mt-compass-2139-l-vs-the-awd-at-tucson-2518-l-18569.htm
I have purchased Jeep Compass 2*4 Limited on 30th November. Delivery date was 5th December. Within a week the vehicle breakdown .Nobody know what happened Road assistance Services brought to Service Center .Now 20 days Over There is no proper solution So far . I thing this premium vehicle .So I expected great service .But my experience was horrible with customer care and i did not get balance amount from the Land mark Mumbai Showroom yet. They are asking impossible things for refund .," Jan 01, 2018 ",By Sadiq P H,1.0,https://www.cardekho.com/user-review/jeep-compass/jeep-is-worst-car-maker-in-india-18856.htm
"Jeep India: Worst Sales team, Fake commitment to deliver car
Very disappointed with Jeep India and their Dealers. Big brand but poor management in India. Fake data they are disclosing that 5000 cars has been delivered or 10000+ booking completed but actual data is wrong, very few cars on road, almost everyone is waiting and wasting their time. Dealers initially promise that they will deliver the car in first...Read More"," Nov 12, 2017 ",By N Sh,1.0,https://www.cardekho.com/user-review/jeep-compass/jeep-india-worst-sales-team-fake-commitment-to-deliver-car-18633.htm
"Good to be back again?this time I am writing a review for the Jeep Compass Longitude Diesel MT. This is the mid segment jeep in the compass series. To start with let me tell you the vehicle is absolutely ?SOLID? heavy build and gives you an impeccable presence wherever you go. So lets talk engine dynamics, the diesel engine of this baby is a 2 Ltr Multijet diesel engine meshed with a 6 speed gear box yielding 173 PS power which is sufficient to propel this vehicle really fast. The acceleration is good but the pickup still might need some work. It can be blamed on the heavy build of the vehicle as the engine after all is 2 ltr. The breaking is pretty efficient as I did try the odd ball 60 KM/HR to ?0? breaking and the vehicle responded perfectly telling me that the ABS and EBD systems gelled perfectly. Let?s talk driving comfort now, although the gear shifts are smooth but the clutch does require some pushing and in city driving you might get a bit of a foot ache if you are not used to it. The vehicle can power down if you are at a low speed trying to drive at a higher gear. One thing I really loved was the electronic parking brake which replaced a hand brake with a nifty little button where the hand brake used to exist. Now coming to the ergonomics on this vehicle, the instrument cluster is well lit and the infotainment system has just the right features. I bought the Longitude and not the optional so features like car play and android auto were not available. They did provide a usb port in the rear which was pretty good. There were a couple of things which did disappoint like there was no climatronic AC, although the door handled has leathered upholstery the seats were fabric which was very disappointing and the Jeep accessory for the seat costed about 16000 MRP. The car has reverse parking sensors but no camera which is not one would expect after paying a good amount for this car and lets face it, it doesn?t cost much. Another things which was painful was that the car?s speaker system was absolutely flat no zing to it. The car does have traction control but not sure how much of that you would use. In summary the car is excellent in terms of handling and well grounded, the features are there but for the price I paid I expected much more. Overall, if you would really like a Jeep with all the bells and whistled go for a Longitude Optional or Limited. Happy and safe driving."," Dec 27, 2017 ",By Samriddh Mangotra,4.0,https://www.cardekho.com/user-review/jeep-compass/jeep-compass-a-great-value-for-money-suv-18826.htm
"Was looking to move on from my good old Mitsubishi Outlander - Yes a petrol suv :). Not a Diesel fan. Criteria was : An SUV, Chic Looks, Automatic Petrol. not much choices available in Indian market.
Shortlisted between :
Fortuner Petrol & Tucson Petrol . Then read some where jeep is launching Petrol with automatic .. so thought should give it a try & thank heavens I did that..!
Result : Booked the Car same day - a Sunday & guess what got delivery on Thursday same week .. wow :) what an experience.. Have drive 300 KM till now, and from my place of work to people on road, to my society, people just can't stop talking about the way it looks .. RED beast with black top..! At 22 Lacs -- super engine, upmarket interior and a fabulous planted ride both in city and highway.. you can't ask more .. plus for us Indians - chance to own a JEEP -- not a fake JEEP but original JEEP.. If anyone is thinking of buying it -- don't think twice .. just go for it.. you won't regret a second of owning it!! With govt regulations being stricter on diesel cars/suv.. this JEEP petrol automatic is the best available SUV over 20 LACs you can buy.. as far as 4*4 how of us.. had or will actually use it in future? Its just a badge for which you pay more and hardly use!"," Nov 21, 2017 ",By Tkt Verified Buyer,5.0,https://www.cardekho.com/user-review/jeep-compass/truly-an-urban-jeep-18665.htm
"In India jeep cars and not supplying very good tyres with the car because in my Jeep Compass car FIRESTONE tyre got BURSTED (only mysore city ride) for 1350KM!
BE AWARE OF IT!!!"," Dec 26, 2017 ",By Abhishek Kumar,2.0,https://www.cardekho.com/user-review/jeep-compass/worst-tyres-in-jeep-cars-18822.htm
"I bought the Jeep Compass just for its head-turning looks. But to my amazement, the Compass has a lot more to offer. The ride quality is sublime and so is the seating comfort. Although the high door sills do get in the way at times, especially when you are in a hurry. The sound system is amazing but I can't say the same for the infotainment display. Yes, it has Android Auto and Apple CarPlay compatibility but there's a noticeable lag in its operation. I have bought the 2.0-litre Limited variant without the 4x4 system. Up until now, I am more than satisfied with the Compass. But as I mentioned above, there are some drawbacks. But then that's the case with all cars I believe. To finish it off, I would just like to add that if you want something different and capable at the same time, the Jeep Compass will not disappoint you."," Oct 12, 2017 ",By Sumita Kapoor,4.0,https://www.cardekho.com/user-review/jeep-compass/the-compass-is-here-to-stay-18551.htm
"Multiple Issues
Bad experience so far...Gear issues accompanied by burning smell. Electronic Parking Brake failure ! All in less than 2000 km !. Even the service team is clueless."," Dec 07, 2017 ",By Srinivasa Rao,1.0,https://www.cardekho.com/user-review/jeep-compass/multiple-issues-18758.htm
"First 3 version of Jeep Compass are not worth the money - but things change when you look at Limited option & onwards. You get all the features one would like to see in a compact SUV - Price is bit higher compared to other brands but brand also matters so i'm sure people will go for Compass & will not look at the price.
Buy it for Brand, Quality, performance and style."," Oct 17, 2017 ",By Ishrat Aziz,4.0,https://www.cardekho.com/user-review/jeep-compass/brand-quality-style-18563.htm
"I have been a huge fan of Jeep badge. The sturdy and macho vehicles that this American brand manufactures are simply unmatchable. I have been following the Jeep Compass since the time it was first showcased. The massive road presence and the sharp styling of the Compass SUV cannot be compared to any other crossover in the country. Apart from this, its tyres will get your heart racing, they are just fantastic.The crossover is fully loaded but the biggest surprise came in the form of the price. Just Rs 14.95 lakh! I am amazed with Jeep's pricing strategy, it undercuts almost all its rivals and is definitely here to rule the Indian automotive arena. The other plus points of the Compass is the availability in both the petrol and diesel engines. Another important bit of the Jeep SUV is the Jeep Active Drive 4x4 system which disconnects rear axle and effortlessly keeps on switching between 4x2 and 4x4 drive types to ensure one gets the 4x4 capability only when it's essential, thus saving the extra effort of the vehicle. I am sure it must be helping out on the fuel efficiency numbers as well. With the Compass, a new beast of performance is here. I am keeping my fingers crossed and will be watching how the sales of the Compass take off. However, the more critical aspect is how Jeep is able to tackle the after-sales service of the Compass in a country obsessed with 'cheap and best' philosophy."," Jul 31, 2017 ",By Micheal Verified Buyer,5.0,https://www.cardekho.com/user-review/jeep-compass/jeep-compass-unbelievably-affordable-18366.htm
"After months of waiting fr it's launch, I booked the top-end 4x4 on the first day the bookings opened.
I am now going to cancel my booking. Reasons:
1. No delivery of 4x4 till Nov.
2. Imminent increase in taxes, & the On-Road Price will go frm 24 to 26 Lacs
3. Pay 26L fr a top-end vehicle, and you still have dummy buttons on the steering, undersized LCD with an odd plastic frame to cover the gap, & most importantly, NO SUN ROOF
4. 70000 diff between Limited & (O), All you get is a Black Roof & HIDJeep is making vehicles with Sun Roof, even the Trailhawk in Pune, but only for export. I can live without the Auto Wipers / Headlights / Cruise Control, but no Sunroof on a 26 Lac (mid-size) car.. doesn't work for me.
While the entry level Compass is priced right, the top-end is overpriced, considering Jeep is palming off an incomplete product to Indian customers."," Aug 23, 2017 ",By S Singh Verified Buyer,3.0,https://www.cardekho.com/user-review/jeep-compass/no-4x4-till-november-no-sunroof-18413.htm
"I saw the Jeep Compass at a nearby dealership today. It is smaller than what it looks in the images. The Tucson, in comparison, looks wider. Sit inside and the quality of the materials used is good. The space is also decent and two six-feet tall guys can sit one behind the other. But it doesn't look as wide as you think it will be. From the driver's seat, it feels as if you're sitting in a vehicle of Creta's size. After sitting in the Compressed, sorry Compass, I felt that the starting price of around Rs 15 lakh is fair, and not very aggressive. Also, considering the reliability issues with the brand in most other markets, even if you are saving some money upfront, it'll be used up on the SUV only, and may not count as savings. There were a lot of people out there to check the Compass in the dealership and it looks like it will sell in good numbers. But I think I'll wait to see how Jeep fares in the after-sales department. I'm not sure if they'll be able to manage it."," Aug 01, 2017 ",By Arun,2.0,https://www.cardekho.com/user-review/jeep-compass/small-suv-18369.htm
"looks 5/5
interior 5/4.5
soft touch leather 5/4
touch screen 5/3
harman kardon 6 speakers 5/5
safety features 5/5
comfortable seats 5/5
low noise cabin 5/5
led front nd rear lights 5/5
smooth drive 5/4"," Aug 10, 2017 ",By Paras,5.0,https://www.cardekho.com/user-review/jeep-compass/good-job-jeep-18388.htm
