ReviewText,ReviewDate,ReviewAuthor,ReviewStarRating,Review Link
"The car is exemplary, well worth the price as well. The quality of the interior and exterior is also stunning. The front looks like an Evoque. The only problem with looks is that the back is not so great. The turbo petrol variant is awesome."," Nov 18, 2019 ",By Holy Crap,5.0,https://www.cardekho.com/user-review/kia-seltos/best-in-the-segment-93975.htm
"Getting into and out of the Seltos is easy and what is sure to impress is the sheer level of quality in the interior; material quality and fit-finish are up there with pricier European cars. The dashboard is neatly laid out and usefully places the infotainment system high up and in the driver?s line of sight. Top-spec Seltos? get slick 10.2-inch touchscreens, the instrument cluster is easy to read and there?s even head-up display. A powered driver?s seat, ventilated front seats, ambient lighting, a 360-degree parking camera, and even an onboard air purifier are other features offered on the Seltos. Front seat comfort is good but the rear seat does lose some points for the somewhat lack of thigh support. While not the roomiest of SUVs for the price, the Seltos offers plenty of space and features like a retractable backrest and retractable sun visors also enhance the rear seat experience.  While we are yet to try out all engine-gearbox options on offer, we did come away very impressed with the 1.5 diesel-manual and the 1.4 turbo-petrol autos. The 115hp diesel is very refined and performance is pleasant. A slick gearbox and a well-weighted clutch also make it easy to live with. Those looking for a sporty drive will find a good match in the 140hp, 1.4 turbo-petrol. The engine is smooth, strong and very likable. Also good is the 7-speed dual-clutch auto that is responsive and quick to shift. What's missing are paddle shifters.  The Kia Seltos is easy to drive. The steering requires reasonable effort and weights up well enough at higher speeds. Ride comfort is good too with nice low-speed bump absorption and confident high-speed manners"," Nov 17, 2019 ",By Suraj Yadav,5.0,https://www.cardekho.com/user-review/kia-seltos/best-car-of-the-year-93899.htm
"This is a Nice Car.
Nice car and having a 180 degree angle camera it has a nice ground clearance and having a great body and the best design it has been a new generation.it has a new and improved infotainment system its light is also great and DMR is so best it indicator is running such a nice car I suggest that this would be the best car. Read More"," Nov 17, 2019 ",By Shekhar Sahu,4.0,https://www.cardekho.com/user-review/kia-seltos/this-is-a-nice-car-93890.htm
"A car is next thing to a cozy home because you tend to live, breathe, grow, eat, sleep in the car you choose and remember its not we who choose a car but its the car who chooses us to stay with us or part from us so Kia Seltos, owning this means great pride and with great pride comes greater confidence which turns out to portray in your drive."," Nov 17, 2019 ",By Gurpreet Singh,4.0,https://www.cardekho.com/user-review/kia-seltos/drive-your-passion-or-ride-with-fashion-93857.htm
"Heart beat
Classy exterior and interior and excellent ride and drive in turbo engine and night view through mood lighting is excellent."," Nov 17, 2019 ",By Mayank Srivastava,5.0,https://www.cardekho.com/user-review/kia-seltos/heart-beat-93907.htm
"Well talking about this car it's phenomenally awesome. It is the car of the future. The car everyone would always want Kia Seltos is truly a great piece of technology with all the requirements needed to the fullest, also the staff of Kia is so helping that it by far the best experience having such a great car."," Nov 18, 2019 ",By Ved Markandey,5.0,https://www.cardekho.com/user-review/kia-seltos/awesome-car-93953.htm
"Car performance
High-speed car with good pick-up, nice interior as well as exterior. I like this car very much. This car is so cool."," Nov 18, 2019 ",By Devashish Yadav,5.0,https://www.cardekho.com/user-review/kia-seltos/car-performance-93969.htm
"The Awesome SUV: Kia Seltos
Kia Seltos is the best in its class. Very good looking. Its comfort level is also good. Great driving experience. Nice SUV for family purposes."," Nov 18, 2019 ",By Amandeep,5.0,https://www.cardekho.com/user-review/kia-seltos/the-awesome-suv-kia-seltos-93936.htm
"WORTH TO BUY IT
It is a beast in this segment. The features are so good and the power delivery is unbelievable. You feel like a luxury comfortable inside and there are no words for it."," Nov 17, 2019 ",By Jashan Waraich,5.0,https://www.cardekho.com/user-review/kia-seltos/worth-to-buy-it-93880.htm
"The car is a great value
This car is very nice and good, you ever see this car, Kia Seltos is very good value of money."," Nov 17, 2019 ",By Sunil Sai Cherry,5.0,https://www.cardekho.com/user-review/kia-seltos/the-car-is-a-great-value-93859.htm
"Best choice
The best choice, in this segment. Though you get the best features in the top model and HTX, I am 100% satisfied with this car."," Nov 17, 2019 ",By Kunal Gupta,5.0,https://www.cardekho.com/user-review/kia-seltos/best-choice-93889.htm
"Reasonable Eeuro 6 SUV
Best mileage SUV in euro 6 category, reasonable price with high end features best interior comfortable automatic transmission."," Nov 17, 2019 ",By Gaurav Abrol Abrol,5.0,https://www.cardekho.com/user-review/kia-seltos/reasonable-eeuro-6-suv-93844.htm
"Great experience with Kia Seltos It's a great experience to drive Kia Seltos. Nice drive, good road-gripping, very luxurious interior, and tremendous exterior. I never get that thrill when I drove other cars before. The one and the only statement about it is the luxurious car in economic price. And mileage also good. So I suggest everyone have this car."," Nov 17, 2019 ",By Viraj Pitale,5.0,https://www.cardekho.com/user-review/kia-seltos/buy-any-model-of-kia-seltos-it-will-satisfy-you-93843.htm
"Great luxury in SUV
Seltos is one of the best cars I had seen till now no doubt it has a good sale for this car in India because it is worth. It has one of the most premium seating."," Nov 17, 2019 ",By Waheedpasha,5.0,https://www.cardekho.com/user-review/kia-seltos/great-luxury-in-suv-93821.htm
"Best in it's Segment
The best car in its segment, this time It is the most advance feature-rich car, GT version is awesome its pickup and the initial response is very good. "," Nov 16, 2019 ",By Anonymous,5.0,https://www.cardekho.com/user-review/kia-seltos/best-in-its-segment-93803.htm
Seltos is the best car in this segment and a segment above! There is no competition between this and other cars it is competing with luxury segments with features like that.," Nov 17, 2019 ",By User,5.0,https://www.cardekho.com/user-review/kia-seltos/awesome-car-gtx-dct-93856.htm
"Best car in world
The best car now in the market, I drive this car I feel comfortable when I am driving more space sports car."," Nov 17, 2019 ",By Adv Siddarth Tanwar,5.0,https://www.cardekho.com/user-review/kia-seltos/best-car-in-world-93845.htm
"Best car when it comes to comfort
Nice car, all advanced features, very comfortable, and easy to drive. Enjoy your time with your family and friends."," Nov 17, 2019 ",By Ashok Kumar Prajapat,5.0,https://www.cardekho.com/user-review/kia-seltos/best-car-when-it-comes-to-comfort-93839.htm
"Disappointed with Seltos
The engine power is not much good as expected and dissatisfied with mileage as it is showing very high on paper but that is not the reality after when you buy."," Nov 17, 2019 ",By Harsh Prakash,3.0,https://www.cardekho.com/user-review/kia-seltos/disappointed-with-seltos-93818.htm
"Excellent car in mid SUV Segment
Seltos is the best car and is a feature-loaded car and has a bs6 compiled engine. No One can compete with Seltos in this segment with this attractive price."," Nov 16, 2019 ",By Dave,5.0,https://www.cardekho.com/user-review/kia-seltos/excellent-car-in-mid-suv-segment-93802.htm
"Kia Seltos is an awesome car and a perfect MUV loaded with features. Worth buying and perfect for the highway purpose. The commute family car, its power, and the audio system from BOSE are totally amazing."," Nov 16, 2019 ",By Samir Khan,5.0,https://www.cardekho.com/user-review/kia-seltos/kias-first-car-in-india-93775.htm
"Kia Seltos is the best car in the market at that price segment and even in the SUV segment. I own one Kia Seltos .its really face turning. Kia Seltos really a beautiful car and it is just an awesome car. Kia Seltos is best in black colour in DCT petrol. Every feature of the market is captured in this car KIA Seltos almost every feature. If u thinking to buy Kia Seltos then I will say you that it is a great car to own. Kia Seltos even average is also so good. Kia Seltos has a great road presence. After the first service, there is an increase in Seltos average."," Nov 16, 2019 ",By Rachit,5.0,https://www.cardekho.com/user-review/kia-seltos/kia-seltos-ownership-review-93746.htm
"It's a great experience to drive Kia Altos. Nice drive, good road-gripping, very luxurious interior, and tremendous exterior. I never get that thrill when I drove other cars before. The one and the only statement about it is the luxurious car in economic price. And mileage also good. So I suggest everyone have this car."," Nov 16, 2019 ",By Joel,5.0,https://www.cardekho.com/user-review/kia-seltos/great-experience-of-kia-seltos-93745.htm
"Kia's first journey
The journey of KIA motors - Seltos has been exceptional so far, it competes very nicely with Brezza at its segment. One of the great things of this car has been the roof, it is very pleasing to have a view of the outside when the see-through glasses is almost edged to edge. Build quality has also been pretty solid. It suits well for Indian roads - ...Read More"," Nov 15, 2019 ",By Kasshyap P,4.0,https://www.cardekho.com/user-review/kia-seltos/kias-first-journey-93727.htm
"Speed and Pickup king
The Hector is too much good I can say nothing but in a few words, I can say that the car speed is very good and the pickup is like Audi or a racecar. I wish everyone to buy this car and the features are also good so please buy this car the features of this car are also like Bugatti but this car price is very low much efficient like Audi or BMW. Read More"," Nov 15, 2019 ",By Anonymous,5.0,https://www.cardekho.com/user-review/kia-seltos/speed-and-pickup-king-93722.htm
"Kia Seltos a featured SUV
The Seltos is an awesome car, the car hols great interiors and works fine. The features are also first in class."," Nov 16, 2019 ",By Man Than,5.0,https://www.cardekho.com/user-review/kia-seltos/kia-seltos-a-featured-suv-93762.htm
"Best car Seltos
We have purchased the new KIA Seltos. We have purchased the HTX version. This car is amazing. The touchscreen is so big that its like a tablet. Its style is very cool too.  Read More"," Nov 15, 2019 ",By Aarjav Singh,5.0,https://www.cardekho.com/user-review/kia-seltos/best-car-seltos-93739.htm
"Good car not so good mileage
Amazing car! Superb driveability, amazing handling, not so great mileage, When I first sat in the car it felt like a luxury car, way above its segment, and honestly, it delivers to my expectations. Read More"," Nov 15, 2019 ",By Allen Pereira,4.0,https://www.cardekho.com/user-review/kia-seltos/good-car-not-so-good-mileage-93738.htm
"Kia seltos is a very nice car
KIA Seltos is very nice and comfortable for everyone, mileage is extremely good and seat capacity is also comfortable."," Nov 15, 2019 ",By Arya Waddader,5.0,https://www.cardekho.com/user-review/kia-seltos/kia-seltos-is-a-very-nice-car-93737.htm
"Unbeatable car
Seltos is an amazing car and is worth buying. Its amazing performance is giving the best competition to Creta and Ecosport."," Nov 15, 2019 ",By Naman,5.0,https://www.cardekho.com/user-review/kia-seltos/unbeatable-car-93729.htm
"It is a real car in the whole automobile industry. I not only like it but prefer to love the design. It is more premium with new features which often seem to be in more expensive German cars. Whatever the car pros and cons are but I look more about its pros. At last but not least, I am having a great smile on my face after having it in my garage."," Nov 15, 2019 ",By Rishabh Bhawani,5.0,https://www.cardekho.com/user-review/kia-seltos/thats-a-real-car-93707.htm
"Best car in the segment
My friend just bought one last week and its hell of a car. It looks smashing on the outside-inside, its elegant and somewhat sporty too but the list of features on this car just goes on. It has a sunroof, Bose audio even an air purifier, I mean tell me one another car under 30 even 40 lacs to offer that and on the top trim there is the light strip ...Read More"," Nov 15, 2019 ",By Rishabh,5.0,https://www.cardekho.com/user-review/kia-seltos/best-car-in-the-segment-93678.htm
"Best SUV in this segment
Best SUV in the current market. Top class design and and high performance. Better than other cars."," Nov 14, 2019 ",By Nazim Mulla,5.0,https://www.cardekho.com/user-review/kia-seltos/best-suv-in-this-segment-93667.htm
"Feature of glory
It is an excellent car for sitting and view. Also comfortable for long-height people and so many features are included in the car."," Nov 15, 2019 ",By Vijay Gidmare,5.0,https://www.cardekho.com/user-review/kia-seltos/feature-of-glory-93698.htm
"Kia Seltos - Smooth Car
Smooth steering and awesome sheets in the front. I feel like this is the only love of my life. Powerful engine gives a extra speed. A tough and smart SUV."," Nov 15, 2019 ",By Kamalendra Singh,5.0,https://www.cardekho.com/user-review/kia-seltos/kia-seltos-smooth-car-93696.htm
"A luxurious car
It is a very fabulous car. The features are very excellent and it has good safety features, convenience, comfort and luxury."," Nov 15, 2019 ",By Anonymous,4.0,https://www.cardekho.com/user-review/kia-seltos/a-luxurious-car-93686.htm
"Seldomly mine
Best in inside entertainment with the latest features and pocket-friendly price. Perfect SUV designed for people."," Nov 15, 2019 ",By Anonymous,5.0,https://www.cardekho.com/user-review/kia-seltos/seldomly-mine-93676.htm
"Excellent with smooth engine
It is a good compact SUV with good mileage, fantastic interiors, front seats are ventilated, Bose speakers and led headlight."," Nov 14, 2019 ",By Sibaprasad Mishra,5.0,https://www.cardekho.com/user-review/kia-seltos/excellent-with-smooth-engine-93674.htm
"Kia Seltos performance
Best look and very powerful engine. It is heavy and steering is very smooth. The brakes and clutch are very soft. World's 1st smart pure air purifier. Bose premium sound system with its speakers. The engine is very refined with 138 BHP. Tiger nose grill. Those looking for a sporty drive will find a good match in the 140 HP and 1.4 turbo petrol engi...Read More"," Nov 14, 2019 ",By Abhineet Singh,5.0,https://www.cardekho.com/user-review/kia-seltos/kia-seltos-performance-93650.htm
"Beast and Elegant
This car looks like a beast, the headlamps are exquisite, the interior seems pretty amazing, the alloy wheels have a unique design."," Nov 14, 2019 ",By Arpan Borah,5.0,https://www.cardekho.com/user-review/kia-seltos/beast-and-elegant-93644.htm
Ye car gajab lagti hai. Jab pehli baar dekhi to aisa man kia ke le lu. Or night mai to iski headlight ke uper ki DRL or bhi jyada achi lagti hai. Size itna bada nahi hai or na hi chota hai or agar wheels ki baat kare to style sabse alag hai matlab aisa design hai jo time beetne ke baad bhi old nahi dikhega.," Nov 14, 2019 ",By Deepak Khatri,4.0,https://www.cardekho.com/user-review/kia-seltos/love-at-first-sight-93664.htm
"Invincible SUV
The Car looks perfect from all the angles. Drives brilliantly. The petrol engine is a hoot to drive and the DCT (Dual Clutch Transmission) gearbox is just the icing on the cake. The car provides best in class features and also some of the first in the segment as well. The bose sound system works like magic. All led headlamps and the gt line spec gi...Read More"," Nov 13, 2019 ",By Dhruv Sharma,4.0,https://www.cardekho.com/user-review/kia-seltos/invincible-suv-93580.htm
"King of Compact Suv Segment.
Nice car in the segment but its better to increase their power. It has a lag like it is getting on fewer mileage vehicles. And if I talk about the interior it's awesome, the music system is awesome and the design of the car seems to be a foreign car and it looks stunning, the seats of the car are very comfortable and the sunroof is pretty good, the...Read More"," Nov 14, 2019 ",By Pradeep Kumar,5.0,https://www.cardekho.com/user-review/kia-seltos/king-of-compact-suv-segment-93619.htm
"Kia Seltos is the Best Car in this Range
The car is undoubtedly the best in the SUV segment. I have driven Creta & MG Hector both when I wanted to buy an SUV. Kia Seltos is far ahead of Creta and marginally ahead of MG Hector. People had no option and they had to go for Creta (Majburi). People who own Creta very well know that Kia Seltos is far ahead of them. I think Kia Seltos gives the ...Read More"," Nov 14, 2019 ",By Rahul Chowdhury,5.0,https://www.cardekho.com/user-review/kia-seltos/kia-seltos-is-the-best-car-in-this-range-93615.htm
"Kia Seltos is an amazing car with muscular body structure and bit more comfort inside, don't underrate the power of 1.5 diesel motor. It's the most feature-full car in its segment I didn't drive the petrol one but it is definitely a good option, the fuel economy is also decent considering its price range. Overall a good package in its segment. Finally superb model. Great design and interior. I Loved it."," Nov 13, 2019 ",By Gauri Patel,5.0,https://www.cardekho.com/user-review/kia-seltos/smooth-drive-kia-seltos-93534.htm
"Very nice car, latest features, good looking car, sound quality awesome, very good braking system and automatic features available, led lights and alloy wheel are very nice."," Nov 13, 2019 ",By Raghuvanshi Shivam Singh,2.0,https://www.cardekho.com/user-review/kia-seltos/awesome-car-93589.htm
"Winner of heart
Technology loaded, the best car and driving is too smooth, the automatic version is also better, it is one of the most preferable car in this segment."," Nov 13, 2019 ",By Vinit Shukla,5.0,https://www.cardekho.com/user-review/kia-seltos/winner-of-heart-93559.htm
"Kia Seltos
Awesome car with great features and outstanding looks loved the performance. Overall 10 out of 10 for this car."," Nov 13, 2019 ",By Manish Jain,5.0,https://www.cardekho.com/user-review/kia-seltos/kia-seltos-93555.htm
"Excellent Car
Excellent car features, comfortable seats, overall the car looks amazing, features wise the car is so pretty and comfortable. "," Nov 14, 2019 ",By Mehak Maheshwari,5.0,https://www.cardekho.com/user-review/kia-seltos/excellent-car-93637.htm
"Love to Ride
Kia Seltos performance is great on all roads. It looks very stunning. Good interior with many options and variants. "," Nov 13, 2019 ",By User,4.0,https://www.cardekho.com/user-review/kia-seltos/love-to-ride-93577.htm
"Very Good Car
This car is very good, it is so beautiful and the car is priced low but the quality of the material used in the car is very good."," Nov 14, 2019 ",By Sahil,5.0,https://www.cardekho.com/user-review/kia-seltos/very-good-car-93611.htm
"Kia Seltos is definitely a car worth considering if you want a compact SUV that is feature-loaded with a budget of 12-20 Lakhs. Comes with a wide range of variants. And unlike the Creta, the top end models also come with Auto Transmission. The DCT gearbox gives a very smooth ride. Also first in Class features like Air Purifier, Heads Up Display make it even more worth the price. The No. Of bookings will clearly tell you what the car is all about."," Nov 12, 2019 ",By Pradnyesh Suryawanshi,5.0,https://www.cardekho.com/user-review/kia-seltos/prefect-suv-kia-seltos-93479.htm
"Fabulous - Kia Seltos
Kia Seltos is a very fabulous car. Its features are very excellent and good safety features, convenience, comfortable and luxurious."," Nov 13, 2019 ",By Priyanka,5.0,https://www.cardekho.com/user-review/kia-seltos/fabulous-kia-seltos-93526.htm
"Kia Seltos is the best ever SUV / MPV car with all the safety features and latest technology in the market in the budget of every middle-class family. Best in class mileage, best performance, super and muscular look make it so appealing in Indian market. Within 3 months of launch with more than 50000+ sales and booking is a record-breaking achievement of the company Kia."," Nov 12, 2019 ",By Niranjan Bansal,5.0,https://www.cardekho.com/user-review/kia-seltos/best-performance-looks-and-features-kia-seltos-93457.htm
"About Its Safety And Look - Kia Seltos
Kia Seltos is a very good car and look is really great with its alloy wheels making the car attractive and very dashing, front headlight are very cool it looks like a beast. Its safety features are great, it has 6 airbags and great space inside, Kia Seltos is a very good car. Read More"," Nov 12, 2019 ",By Vraj Panchal,5.0,https://www.cardekho.com/user-review/kia-seltos/about-its-safety-and-look-kia-seltos-93454.htm
"Kia Seltos is a nice car and features are also good but as compared to other cars price is too high but value for money and I like the shape of the body, the design of the mac wheels are just awesome. The shape and design of the car look like its a millionaires car, just loved it. Thank you."," Nov 11, 2019 ",By Amalendu Ghosh,5.0,https://www.cardekho.com/user-review/kia-seltos/nice-car-just-loved-it-kia-seltos-93373.htm
"Very Good SUV - Kia Seltos
Kia Seltos is a very good car and very good engine performance and safety features are just great. A very good car in this price range. "," Nov 11, 2019 ",By Ravindar Joshi,5.0,https://www.cardekho.com/user-review/kia-seltos/very-good-suv-kia-seltos-93379.htm
"Best And Beautiful - Kia Seltos
Kia Seltos speaker is very best and all its features are amazing. Its engine is very best and this car gives the very best feeling of driving an SUV."," Nov 12, 2019 ",By Dhruv Sharma,5.0,https://www.cardekho.com/user-review/kia-seltos/best-and-beautiful-kia-seltos-93473.htm
"Best Car - Kia Seltos
Kia Seltos is an extremely tremendous car in the field of compact SUV. The car that has uplifted standard of the Indian automobile industry."," Nov 12, 2019 ",By Arun Kumar Bhardwaj,5.0,https://www.cardekho.com/user-review/kia-seltos/best-car-kia-seltos-93450.htm
"Kia Seltos has got the powerful engine of about 1.5L, has great ground clearance. It has got the best interior at this price range. Has got a huge touch screen infotainment system, has the best speakers of bose. The inside colour ambient is great. Got airbag as safety. The car is worth its price. "," Nov 11, 2019 ",By Navaneeth Vs,5.0,https://www.cardekho.com/user-review/kia-seltos/best-in-class-kia-seltos-93413.htm
"I have bought the Kia Seltos HTX IVT petrol. It's an awesome car. Completed 200 kms in 2 days, the experience is fantabulous. Kia Seltos is the best car on the road, it's a value for money car. "," Nov 12, 2019 ",By Deepak,5.0,https://www.cardekho.com/user-review/kia-seltos/best-car-kia-seltos-93490.htm
"Kia Seltos styling is excellent. Tyre size is adequate. 1.6 ltr CRDI is same as Creta except it is BS6 which is great and is a very refined engine. Steering response is good but not sharp. The infotainment system is excellently backed by the Bose speakers. The sound quality and the bass is very satisfying. The headlights are effective, especially on the highway."," Nov 09, 2019 ",By Aditya Nair,5.0,https://www.cardekho.com/user-review/kia-seltos/the-great-kia-seltos-93252.htm
"King - Kia Seltos
Kia Seltos looks so amazing and interior leather finishing takes the car at another level and second thing, the exterior of the car looks fantastic but the problem is when we talk about its interior the customer will fell like he is in a BMW series 7 if we compare it with Toyota Innova Crysta or some other cars its really luxurious. Hope you enjoye...Read More"," Nov 10, 2019 ",By Nirmal Singh,5.0,https://www.cardekho.com/user-review/kia-seltos/king-kia-seltos-93336.htm
"I purchased the Kia Seltos HTK Plus Diesel one month back. I drove it about 3K Km in last one month. I couldn't find any single point of disappointment. With head-turning looks, everyone finds it so attractive and innovative design. I got around 16-17 Km per lit average Delhi and 21 Km on Punjab Highway. Superb pickup. Just one betterment KIA can do, that making rear seat armrest and seat reclining include in all variants. This will add comfort for rear-seat without much investment. I am very happy with the features, styling, and performance. Kia should rapidly work on accessories and spare availability to keep themselves ahead against the competition. Failing to this, Indian customer may be distracted easily by upcoming Hyundai and Fords new models."," Nov 10, 2019 ",By Anonymous,5.0,https://www.cardekho.com/user-review/kia-seltos/superb-experience-kia-seltos-93334.htm
"The Best - Kia Seltos
Kia Seltos is the best in the industry right now. Best in its segment and has a very premium look.  Highlights:- 1. Bose audio system (for selected models). 2. Seats are comfortable, the driver's seat is like heaven. 3. You won't even experience bumpiness even in city limits because of the high-class suspension used. Read More"," Nov 10, 2019 ",By Pvr Madhav,5.0,https://www.cardekho.com/user-review/kia-seltos/the-best-kia-seltos-93314.htm
"Massive Car In Segment - Kia Seltos
Kia Seltos is one of the most luxurious car in the segment. All first in class features, one of the best family car and looks so impressive worth for money."," Nov 11, 2019 ",By Prem Kumar,5.0,https://www.cardekho.com/user-review/kia-seltos/massive-car-in-segment-kia-seltos-93370.htm
