ReviewText,ReviewDate,ReviewAuthor,ReviewStarRating,Review Link
"Best car in its segment. Excellent drivability, superb engine, amazing ergonomics, wonderful comfort, and humongous space. The car is a total package of comfort and performance. Seats are adjustable for both driver and front passenger side. Loads of legroom for the rear passengers. Excellent boot space. Better buy than Jeep Compass or Hyundai Creta...Read More"," Dec 04, 2019 ",By Megh Rishi,5.0,NA
"Kia as soon as it landed in India came with a bang for the buck competing with its sister company Hyundai's Creta, the Jeep Compass and the MG Hector which again was recently launched. Seltos gave us a variety of features with 2 lineups total of 5 variants that can suit your choice and has premium features."," Dec 03, 2019 ",By Carlocity India,5.0,https://www.cardekho.com/user-review/kia-seltos/the-turning-point-of-suv-in-indian-market-95342.htm
"Purchase it and feel the difference.
Features loaded car beyond expectations. Wonderful engine, superb interior with amazing quality, fabulous fit, and world-class finish."," Dec 04, 2019 ",By Ig Bhullar,5.0,https://www.cardekho.com/user-review/kia-seltos/purchase-it-and-feel-the-difference-95520.htm
"A very nice car with bose speakers, which is not available in other cars in its segment. Worth buying it. This car is spacious, safe, powerful. This car comes with 6 airbags, sufficient boot space, and sunroof. Ambient mood lighting gives a luxurious and soothing experience."," Dec 03, 2019 ",By Rajat Mani Bhardwaj,4.0,https://www.cardekho.com/user-review/kia-seltos/nice-car-with-best-in-class-features-95382.htm
"We brought the Kia Seltos HTK in petrol 2 months ago and the car is fabulous. You get all the features even in the base variant. You name it and its there. It has a 6 speaker JBL music system, an intelligent MID projector setup for both headlamps and foglamps. It is a very nice car and you should buy it instead of its rivals. However, spare parts a...Read More"," Dec 03, 2019 ",By Siddharth Bazad,5.0,NA
"I felt very glad by its modern advanced technology and innovative design still, it's so smart due to Long-Durability, Safe, Secure and Lightweight. It's one of my favorite cars known for ""Kia Seltos"", we would feel simple by architecture style ever."," Dec 03, 2019 ",By Idream Tech,5.0,https://www.cardekho.com/user-review/kia-seltos/architecture-style-95348.htm
"Kia has debuted in the Indian car market by launching a great car Seltos. Though based upon Hyundai Creta, yet many steps ahead of the techology, comfort, styling ride and handling. I think mileage could be a negative aspect. Still, it's a great car."," Dec 02, 2019 ",By Sunder Chettiyar,5.0,https://www.cardekho.com/user-review/kia-seltos/excellent-experience-95335.htm
"Very comfortable car.
This car has a very comfortable sitting arrangement and a very good leg space."," Dec 03, 2019 ",By Anil Seervi,5.0,https://www.cardekho.com/user-review/kia-seltos/very-comfortable-car-95384.htm
"Awesome looks.
To be very honest this SUV has a sporty look and as per the company, it has a thrilling design, including the interior. Highly recommended."," Dec 03, 2019 ",By Piyush,4.0,https://www.cardekho.com/user-review/kia-seltos/awesome-looks-95370.htm
"Best car for this year.
This car is delivering a very good performance. Great looks."," Dec 02, 2019 ",By Rascal Trends,5.0,https://www.cardekho.com/user-review/kia-seltos/best-car-for-this-year-95301.htm
"Best SUV car of the era.
Kia Seltos became one of the best prime SUV cars of this era in India. The car has a best-finished premium looking with ultimate build quality till now in the Indian car market. In this price range, it gives many loaded features as follows:  1. It has a 360-degree camera. 2. Both front and rear parking assistance are given. 3. Has an adequate bo...Read More"," Dec 02, 2019 ",By Anonymous,5.0,https://www.cardekho.com/user-review/kia-seltos/best-suv-car-of-the-era-95257.htm
"I brought Seltos HTX one week back. This is my 6th car following Innova Crysta, XUV500, Duster, Honda City, and Dzire. I can safely say that this is the best overall car in this price range presently. This car is a near-perfect vehicle by many angles. Its design is fantastic, looks are fantastic, features are amazing, refinement is excellent, NVH levels are superb, ride quality is superb and easily comparable to my Innova Crysta. Diesel manual mileage is excellent, seat comfort is superb. The back seat of this vehicle occupies 3 people comfortably. Boot space has enough space for the luggage of five people for a short trip. I drove this vehicle on really ugly Bhokar-Nanded road of Maharashtra (bad would be a word for this road at present which I think) and I can assure you that , this vehicle has one of the best ride quality which can be easily comparable to my Innova Crysta in terms of ride quality. Seltos is breeze to drive. I drove the petrol GT line also for short distances, and it is also a great variant to own. You can go for either variant as per your needs and choice. Both variants are great. Diesel is giving me 17kmpl overall at present for 60% highway and 40% city drive with AC 100% on. I hope, mileage will definitely increase after the second service(oil change) to 19Kmpl overall. A smart air purifier with perfume diffuser is an added advantage. AC is powerful and works fantastically. In my opinion, At present, there is no competitor for Seltos, when it comes to the overall package."," Dec 01, 2019 ",By Sonu Sidhu,5.0,https://www.cardekho.com/user-review/kia-seltos/best-ride-95216.htm
"Its a good car.
Its a nice car with great features, amazing headlight, suspension, nice pick-up."," Dec 01, 2019 ",By Aditya Agarwal,5.0,https://www.cardekho.com/user-review/kia-seltos/its-a-good-car-95165.htm
"Amazing it is.
I am feeling great with this car. It has a quite good handling, nice road grip, great stability, also great acceleration, and engine noise is quite low. Talking about interiors it's just wow. Lots of space, comfortable to sit, and love the driver's electronic adjustment. Don't have words about ventilated seats, and infotainment touch is a superb th...Read More"," Dec 02, 2019 ",By Funny Videos,5.0,https://www.cardekho.com/user-review/kia-seltos/amazing-it-is-95250.htm
"Perfect one.
Great car with looks, mileage, power, comfort, and ultimate driving pleasure. All in all an absolute value for money car."," Dec 02, 2019 ",By Shashank,5.0,https://www.cardekho.com/user-review/kia-seltos/perfect-one-95251.htm
"Car of gadgets.
Kia Seltos can be called as a car of gadgets. It has a handful of features but only in GT line. For HT line it has only 2 airbags even for X Plus which is the diesel top-end model. It has 17inch diamond-cut alloy wheels, 8inch heads-up display, 360° camera, blind view monitor, red color brake caliper only for GT line X plus variant. In HT line K pl...Read More"," Dec 01, 2019 ",By Anonymous,4.0,https://www.cardekho.com/user-review/kia-seltos/car-of-gadgets-95178.htm
"Awesome car for middle class.
Fully loaded car with super new generation features and economically best for middle-class people."," Dec 02, 2019 ",By Shashank H T,5.0,https://www.cardekho.com/user-review/kia-seltos/awesome-car-for-middle-class-95285.htm
"It's the best car which I have ever seen and yes it is a new company, so some people might think to purchase it or not. My experience says that every guy must at least test drive it and I'm sure, once driven, will be bought for sure."," Dec 01, 2019 ",By User,5.0,https://www.cardekho.com/user-review/kia-seltos/best-car-of-my-life-95199.htm
"Awesome car.
A very comfortable and advanced feature, my friend bought this car and its superb car with great features. The engine is more powerful than my car. I like the sensors in this car. Read More"," Dec 02, 2019 ",By Balram Karma,4.0,https://www.cardekho.com/user-review/kia-seltos/awesome-car-95294.htm
"Amazing car.
At such price, the number of features and BS6 refined engine, it's amazing."," Dec 01, 2019 ",By Nilesh Kalbhor,5.0,https://www.cardekho.com/user-review/kia-seltos/amazing-car-95161.htm
"Kia Seltos is the best segment car I have ever seen. This car is fantastic due to its features regarding safety, infotainment etc. This car is a budgeting car and easily affordable when compared with other cars from other companies. This car is a king of highways. So smooth to drive and easily controlled. This car breaking quality is unbelievable. Kia Seltos cannot get any compromise regarding safety and breaking quality. This is the best thought of the Kia company. At the end I would like to say that this car is best according to its price, providing very good features at less price, for safety purpose etc "," Nov 30, 2019 ",By Parveen,5.0,https://www.cardekho.com/user-review/kia-seltos/unbelievable-car-95034.htm
"The best thing about the car is the interior and exterior features. It is provided at such a reasonable price, and it is simply the best in its segment and it makes Seltos the best car."," Dec 01, 2019 ",By Kamalpreet Sodhi,5.0,https://www.cardekho.com/user-review/kia-seltos/amazing-car-95160.htm
"Best car ever.
Nice car with all features. This car is very well designed and delivers a good performance. Build quality and interior is so good."," Nov 30, 2019 ",By Bhupendra Khichi,5.0,https://www.cardekho.com/user-review/kia-seltos/best-car-ever-95104.htm
"A car for everyone.
The best car in this segment. Never hesitated before buying this car. I just want to say go for it. If you still have doubt go and test drive it."," Nov 30, 2019 ",By Deshgaurav Kaushik,5.0,https://www.cardekho.com/user-review/kia-seltos/a-car-for-everyone-95092.htm
"The excellent car, I have never seen any car with those features in India. It's a superb car at a low budget, I have never seen all the features in a low budget car. It felt like, I am using a luxury car like (Benz, BMW etc), ride quality is smooth which is of next level."," Nov 29, 2019 ",By Muhammed Hisham,5.0,https://www.cardekho.com/user-review/kia-seltos/superb-and-next-level-95012.htm
"The best car.
It is the best car in segment, I love this car because of its features and engine in this car. You can also get heads up display of 8 inches which very convenient."," Dec 01, 2019 ",By Vansh Jiwanani,5.0,https://www.cardekho.com/user-review/kia-seltos/the-best-car-95135.htm
"Car of the year.
Kia Seltos is the best car in the 2019 car collection. This car is comfortable and featureful as compared to other cars."," Nov 30, 2019 ",By Aman Boora,5.0,https://www.cardekho.com/user-review/kia-seltos/car-of-the-year-95093.htm
"The looks are amazing, and the design is excellent. The interior of the car makes it a true premium Car. The dashboard is fantastic, and the piano finish is so cool. The design of headlights and the music system's screen is so cool. I have no words to describe the Kia Seltos."," Nov 30, 2019 ",By Nikhil Jangid,5.0,https://www.cardekho.com/user-review/kia-seltos/amazing-car-95109.htm
"Magnificent car.
Good quality interiors and shockers are so reflective even a large bump wouldn't make a difference. Good seating command and price is on the quite higher side."," Nov 30, 2019 ",By Nikhil Reddy,4.0,https://www.cardekho.com/user-review/kia-seltos/magnificent-car-95049.htm
"Looking nice.
Superb car and the red color is the best one. My SUV experience is far way better than Scorpio. I really like this car."," Nov 29, 2019 ",By Fozlul Fozlul Karim,5.0,https://www.cardekho.com/user-review/kia-seltos/looking-nice-95018.htm
"The perfect car for everyday use. It's not too big and not too small. A good car for a family getaway and can take long vacations also. The technology provided is mind-blowing and with this price point, it's a bargain. The best part of Seltos is that it can be selected from a wide range of variants which makes it easy for anyone who is looking into compact SUVs and further can select the variant which fits within their budget."," Nov 29, 2019 ",By Hritvik Jadhav,5.0,https://www.cardekho.com/user-review/kia-seltos/the-game-changer-94972.htm
"Amazing feature loaded SUV.
It's a very good car, good to drive and has awesome segment-first features. Interior Plastic quality is good too. Ride quality below 60 is amazing it soaks almost all small patches of road, the cabin is quieter than most of the rivals plus to make cabin, even more, the better place they have provided with a proper air purifier which a good thing fo...Read More"," Nov 29, 2019 ",By Rajat Kumar Gupta,4.0,https://www.cardekho.com/user-review/kia-seltos/amazing-feature-loaded-suv-94947.htm
"Amazing machine
Its too good compared to swift as well. Good in automatic transmission gives the best mileage."," Nov 29, 2019 ",By Rohitash Sharma,5.0,https://www.cardekho.com/user-review/kia-seltos/amazing-machine-94950.htm
"Kia the super car.
It is a nice car as it has good features in it and suitable for people who go mountain trailing. I like this car as it has sunroof and moonroof. It is comfortable and spacious with good leg rest. The outer look is very classy, till I know Kia is good brand company and has a good impression in the market. Read More"," Nov 29, 2019 ",By User,5.0,https://www.cardekho.com/user-review/kia-seltos/kia-the-super-car-94962.htm
Best car in the segment. Quality level is superb. Standard features are available. Mobile connectivity improves the impression of the car. The instrument cluster is awesome. Air conditioning works well. A good amount of legroom offered. In every aspect it is superb.," Nov 29, 2019 ",By Anonymous,5.0,https://www.cardekho.com/user-review/kia-seltos/must-buy-94925.htm
"Lovely car.
This car is amazing as it has new amazing features and new driving options which makes this car best so far."," Nov 29, 2019 ",By Rushi Jadhav,5.0,https://www.cardekho.com/user-review/kia-seltos/lovely-car-94988.htm
"Amazing cars like S class features installed.
Great car with super engine with body quality & amazing features. Amazing colours with sporty look. Superb strong built quality."," Nov 29, 2019 ",By Akhilesh Akshay,5.0,https://www.cardekho.com/user-review/kia-seltos/amazing-cars-like-s-class-features-installed-94939.htm
Kia Seltos the amazing car or one can say the amazing SUV so far. Especially the interior of the leather side and leather seats are amazing. Chromium plating looks nice. Highly recommended. ," Nov 29, 2019 ",By Vaibhav Bhasin,5.0,https://www.cardekho.com/user-review/kia-seltos/amazing-suv-94985.htm
"Recommended.
The best petrol engine in this segment. It is a great pressure to ride this machine in it's 3rd and 4th gear. The performance is amazing and mileage may vary from 10-19 as per the driving style. Read More"," Nov 29, 2019 ",By Karthik Karz,5.0,https://www.cardekho.com/user-review/kia-seltos/recommended-94984.htm
"Kia Seltos
I like Kia Seltos because its front and back side gives us an SUV feel and looks like a luxurious car. I love Kia Seltos more than MG Hector. "," Nov 29, 2019 ",By Dilshed,5.0,https://www.cardekho.com/user-review/kia-seltos/kia-seltos-94926.htm
"Awesome car.
It is an awesome car and cost-effective as well. All required features available. Best in design, big display and drive comfort. "," Nov 28, 2019 ",By Narendra,5.0,https://www.cardekho.com/user-review/kia-seltos/awesome-car-94800.htm
"Kia Seltos is awesome.
Superb car as it looks like Hulk. This can be at the top of the Indian market."," Nov 28, 2019 ",By Sandip Jadav,5.0,https://www.cardekho.com/user-review/kia-seltos/kia-seltos-is-awesome-94860.htm
"Better then Hyundai Creta.
Kia Seltos is better than Hyundai Creta. Its stability is 10/10 and the built Quality is also 10/10."," Nov 28, 2019 ",By Kushal,5.0,https://www.cardekho.com/user-review/kia-seltos/better-then-hyundai-creta-94858.htm
"Amazing car.
Looks amazing and wonderful. I would highly recommend this to others as well."," Nov 28, 2019 ",By Manvendra Pratap Singh Rajan,4.0,https://www.cardekho.com/user-review/kia-seltos/amazing-car-94820.htm
"Perfect Family Car.
Compact and everything at similar price initially. I was going to take Ford Ecosport but though to take this one and I think I took the right decision. "," Nov 28, 2019 ",By Ratnesh,5.0,https://www.cardekho.com/user-review/kia-seltos/perfect-family-car-94819.htm
Kia has debuted in the Indian car market by launching a great car Seltos though based upon Hyundai Creta. Yet many steps ahead of tech comfort styling ride and handling. Though I think mileage could be a negative side.," Nov 28, 2019 ",By Kundan Patel,5.0,https://www.cardekho.com/user-review/kia-seltos/amazing-machine-94805.htm
"Kia has debuted in Indian car market by launching a great car. Though it is based upon Hyundai Creta. Yet many steps ahead of tech comfort styling ride and handling. Mileage is quite lesser still, it's an amazing car. "," Nov 28, 2019 ",By Alok Narayan Pandey,5.0,https://www.cardekho.com/user-review/kia-seltos/driving-experience-was-amazing-94868.htm
"Kia is just Mind-blowing.
Just an amazing car. I wanna say go for it. Looks are amazing and have brilliant interior and exterior design. It gives a luxurious feel."," Nov 28, 2019 ",By Ganesh Hingne,5.0,https://www.cardekho.com/user-review/kia-seltos/kia-is-just-mindblowing-94816.htm
"Ok car.
I will give Kia Seltos 2 stars because of new generation technology. It still needs too many tests on the engine. Looks are good but the car is okay."," Nov 28, 2019 ",By Sahil Arya,2.0,https://www.cardekho.com/user-review/kia-seltos/ok-car-94833.htm
"This is actually the best offering in the current price range. The range-topping GTX+ model which now also comes in both Petrol and Diesel comes with features that none of the vehicles in the current market offer. 6 Airbags are standard in the GTX+ models. The suspension might not be as good as the Harrier's, but then you forget what has the suspension from the Range Rover Discovery. So in short, this is actually the best suspension in the mid-size SUV segment."," Nov 28, 2019 ",By Nikhil Rai,4.0,https://www.cardekho.com/user-review/kia-seltos/worth-buying-94825.htm
"Variety of features it has.
The top model in the diesel engine is too amazing. Its too silent when the car is switched off or when it is turned on, it has very good sound quality, great boot space, amazing interior features, the feature of cooling, the rear seats is also great, back camera has superb quality, its very smooth no matter it is on which speed, the lights below th...Read More"," Nov 28, 2019 ",By Shubham Sharma,5.0,https://www.cardekho.com/user-review/kia-seltos/variety-of-features-it-has-94793.htm
Poor performance... Pickup is not satisfying numbers. The average is very low as ComPare to the company claimed... Feeling trapped with this new company. If there would b any chance then I would like to take my money back... One month's driving experience was very frustrating and trauma.," Nov 27, 2019 ",By Neetu Singh,1.0,https://www.cardekho.com/user-review/kia-seltos/poor-performance-94679.htm
"Perfectly an Indian car.
The best segment with new technology. The best driving experience and looks are amazing.    "," Nov 28, 2019 ",By Sonu Bhati,5.0,https://www.cardekho.com/user-review/kia-seltos/perfectly-an-indian-car-94791.htm
"Good investment for service
Awesome car and excellent driving experience. What an AC which adjusts in car. It was a good experience in my life."," Nov 27, 2019 ",By Ravi Shukla,5.0,https://www.cardekho.com/user-review/kia-seltos/good-investment-for-service-94717.htm
"Best, but not have some features according to XUV 300 have more features than Seltos. According to price xuv300 have low.. Kia Seltos have less service XUV300 gave better than Kia Seltos. Break assist is not there and it has fewer options better than other cars."," Nov 27, 2019 ",By Sandeep Vecha,2.0,https://www.cardekho.com/user-review/kia-seltos/kia-vs-mahindra-94692.htm
"Best car
Perfect in class, design, interior, perfect in mileage, ground clearance. Perfect is the final word for it."," Nov 26, 2019 ",By Nishant Jain,5.0,https://www.cardekho.com/user-review/kia-seltos/best-car-94618.htm
"Free servicing At Zero price which is a very necessary thing.
The very amazing thing about KIA is that they are offering free servicing for 5 years, it means you only drive it, servicing is free by KIA."," Nov 27, 2019 ",By Rahul,5.0,https://www.cardekho.com/user-review/kia-seltos/free-servicing-at-zero-price-which-is-a-very-necessary-thing-94661.htm
"Excellent car
Very nice car. It is very comfortable for a family. It is really like an SUV with a very beautiful interior."," Nov 27, 2019 ",By User,5.0,https://www.cardekho.com/user-review/kia-seltos/excellent-car-94676.htm
The car looks great and we have purchased the diesel auto top-end model in which all the things are great. But illuminated keys for windows and door lock is missing. We have to search for the buttons in the dark. Overall the car is great in performance and looks.," Nov 27, 2019 ",By Sai Lokesh,5.0,https://www.cardekho.com/user-review/kia-seltos/good-car-with-minor-mistake-94667.htm
"Very comfortable seat
Very comfortable and adjustable seat, the front panel is good in looks, navigation is average, the car looks good from outside."," Nov 27, 2019 ",By Anil Sharma,4.5,https://www.cardekho.com/user-review/kia-seltos/very-comfortable-seat-94666.htm
"The top model in the diesel engine is too amazing. Its too silent when the car is switched off or when its turn on, it has very good sound quality, great boot space, amazing interior features, the feature of cooling, the rear seats is also great, back camera has superb quality, its very smooth no matter it is on which speed, the lights below the dashboard looks amazing, its a superb car."," Nov 26, 2019 ",By Ajay Manchhani,5.0,https://www.cardekho.com/user-review/kia-seltos/variety-of-features-94591.htm
It is an excellent car with good features. It moves smoothly on off-roads. Its suspension is also good. It gives you good mileage with the best sound system which makes your ride wonderful and makes you feel luxurious. You can buy this with closed eyes. It's the best car I have seen ever in my life.," Nov 25, 2019 ",By Vipul Yadav,5.0,https://www.cardekho.com/user-review/kia-seltos/kia-seltos-the-best-car-94557.htm
"I just got the chance to sit in one of my uncle's Kia Seltos and what can I say I was just trying to find any flaws but I couldn't. Everything is so perfect in this price bracket that you can't imagine this level of comfort and quality in a car, I just loved it."," Nov 25, 2019 ",By Abhishek Gupta,5.0,https://www.cardekho.com/user-review/kia-seltos/east-or-west-kia-seltos-is-the-best-94539.htm
KIA Seltos is completely spacious and is a smooth experience. It is worth 12 lakhs and is simply amazing. Seltos comes with a touch screen music panel and is quite good in function. Good mileage and pick up.," Nov 26, 2019 ",By Kushal Songh,5.0,https://www.cardekho.com/user-review/kia-seltos/best-in-class-vehicle-94608.htm
"Great Car
KIA Seltos is a very nice car with the great built quality and lots of amazing features. The driving is also very comfortable on any kind of road."," Nov 26, 2019 ",By Rohit,5.0,https://www.cardekho.com/user-review/kia-seltos/great-car-94600.htm
"Best Car
Excellent to drive and comfortable, features are excellent. Best in the segment. Overall, Value for money car."," Nov 26, 2019 ",By Rajil,5.0,https://www.cardekho.com/user-review/kia-seltos/best-car-94587.htm
"Excellent Car
This car is excellent in driving and features are amazing. The front of the car is very attractive and the full LED looks amazing at night."," Nov 26, 2019 ",By Sunny Mighty,5.0,https://www.cardekho.com/user-review/kia-seltos/excellent-car-94578.htm
"I have purchased KIA Seltos HTK Petrol last month, and I am fully satisfied with the my Seltos. The overall performance of the car is amazing in terms of driving experience, infotainment system, build and at last the mileage of Kia Seltos. I have almost driven 1700 KM and average coming 15KMPL in the city, and goes 20KMPL on highways. So, I am highly satisfied with my KIA Seltos."," Nov 26, 2019 ",By Gagan Kanojia,5.0,https://www.cardekho.com/user-review/kia-seltos/satisfactory-performance-of-kia-seltos-94575.htm
"Superb Car
The design of this car is very nice. Bose speakers are of nice quality and the sound is excellent, sunroof is an add on with very nice alloys in the top model. "," Nov 26, 2019 ",By Aarti Gupta,5.0,https://www.cardekho.com/user-review/kia-seltos/superb-car-94572.htm
"Super budget SUV car
Kia Seltos is one of the good specific SUV in economic range of budget. It is a more functional car compared to other cars."," Nov 25, 2019 ",By Chitrang Shah,4.0,https://www.cardekho.com/user-review/kia-seltos/super-budget-suv-car-94541.htm
"A perfect car - Kia Seltos
Kia Seltos is a perfect car. Its design, looks, features and build quality are so excellent. Especially for our Indian roads feels so comfortable and the mileage what the car is offering is just awesome and the performance is just fantastic. The beautiful things are LED and the DRLs design, UVO Connected car - KIA(Know It All), ventilated seats, sm...Read More"," Nov 25, 2019 ",By Anonymous,5.0,https://www.cardekho.com/user-review/kia-seltos/a-perfect-car-kia-seltos-94522.htm
"Best car
Good looking car and the ground clearance is sufficient as compared to other cars as it is very important for the driving experience."," Nov 25, 2019 ",By Rohit Singh Sikarwar,4.0,https://www.cardekho.com/user-review/kia-seltos/best-car-94531.htm
"Good looking car
Excellent car with good suspension and a great car for long drives. The mileage is ok for the city drive. You can buy this car with closed eyes."," Nov 25, 2019 ",By Snair,5.0,https://www.cardekho.com/user-review/kia-seltos/good-looking-car-94524.htm
